ANSWER,QUESTION.question,QUESTION.paragraph
80%.,What percentage of water in India is used for irrigation?,It has been estimated that 80% of available water in India is being used for irrigation purposes.
2011.,In which year was the per capita availability of surface water 1902 cubic meter?,The per capita availability of surface water which used to be 2309 cubic meter in 1991 has decreased to 1902 cubic meter in 2011.
1401 cubic meters.,What is the estimated per capita availability of water by 2025?,"As per an estimate it will further decrease to 1401 cubic meter by 2025, putting at risk 30% of our crop production."
It has evolved improved water management technologies.,What has been the role of Agriculture Research System?,Agriculture Research System has evolved a number of improved water management technologies for enhancing the agricultural productivity per unit volume of water.
To meet mankind's needs and preserve eco system functions.,What are water resources managed for?,"Having limited resources for fresh water, it has to be managed judiciously with improved use efficiency so that it can be maintained to meet the need of mankind in times to come along with preservation of hydrological and biological functions of the eco system."
Heavy water losses during conveyance and application.,What has led to the low efficiency of water utilization at farmers’ fields?,"However, the efficiency of water utilization at farmers’ fields has been very low because of heavy water losses during conveyance and application at the field level."
It has decreased and is estimated to decrease further.,What has been the trend in the per capita availability of surface water since 1991?,"The per capita availability of surface water which used to be 2309 cubic meter in 1991 has decreased to 1902 cubic meter in 2011 and as per an estimate it will further decrease to 1401 cubic meter by 2025, putting at risk 30% of our crop production."
They need to sustain and enhance agricultural productivity.,What challenge is posed to agricultural scientists by decreasing per capita availability of water?,The decreasing per capita availability of water is posing a challenge for agricultural scientists to sustain and enhance the agricultural productivity.
