question,answers
define Intercropping.,"Planting different crops together in the same field can help improve soil fertility by reducing pests and diseases, improving soil structure, and adding organic matter to the soil."
what is crop age?,"The time from planting to the date of assessment, inspection or any other key activity."
name the application of the cassava glue.,"paper mache, bookbinding, and woodworking"
which other field is RFID being used?,hay
which other pest management activities can be done to control termides.,"planting cassava in well-drained soil, using physical barriers such as plastic mulch or wire mesh around the plant stems to prevent termite access, and avoiding over-fertilization or excessive use of organic matter which can attract termites."
what are Water-absorbing polymers,"These are synthetic materials that can absorb and retain large amounts of water, releasing it slowly to plant roots. They can be added to soil or mixed with fertilizer, and can help reduce watering frequency and improve plant survival during drought conditions."
how does S. exempta reduce the risk of SpexNPV,via density-dependent prophylaxis
"which beetle feed on the leaves of bean plants, causing holes and defoliation, which can reduce yields.",Bean leaf beetles (Cerotoma trifurcata)
What kind of technology do farmers use in the field to help the environment?,"GPS (global positioning systems) is a common technology used by farmers. With GPS, farmers can track every location on the farm and know what the soil needs at that exact location"
How is maize streak disease transmitted.,"transmitted by an insect vector called the maize streak virus vector or ""leafhopper."" "
Is maize growth affected by altitude?,The expert will reachout to help
How is CBB spread?,"CBB is spread through infected planting material, contaminated soil, and water"
what is fumigation.,"is the treatment of a structure to kill pests such as wood-boring beetles by sealing it or surrounding it with an airtight cover such as a tent, and fogging with liquid insecticide for an extended period, typically of 24�72 hours"
name any insecticides that can be used on cassava beetles.,neem oil or pyrethroids
what factors should be considered when a applying NPK fertilizers on maize plants.,"soil fertility, crop growth stage, and local recommendations"
what is Poaceae.,Poaceae is a family of flowering grasses which includes cereal grasses and the grasses of grasslands and pastures
how does seed drying prevent spoilage.," Drying seeds effectively reduces the risk of spoilage during storage. Moisture provides a favorable environment for the growth of microorganisms, such as fungi and bacteria, which can attack and damage seeds. By reducing moisture content through drying, farmers can inhibit the growth of these organisms and minimize the risk of seed spoilage and loss."
how is low-till farming done?,"In low-till, fields are covered once, maybe twice, with a tillage implement either ahead of crop planting or after the previous harvest. The fields are planted and fertilized. Weeds are controlled through the use of herbicides, and no cultivation tillage is done during the growing season."
at what stage does cassava requires about 500 to 750 mm of rainfall.,maturation stage
what does Cutworms  feed on.,"These caterpillars feed on the stem of young bean plants, cutting them off at ground level and causing wilting and death of the plant."
Name cultural  techniques for managing crop nutrients use.,crop rotation or a fallow period
Do cows cause global warming? ,cattle production is not a top contributor to greenhouse gasses
at what stage does the cutworms attack cassava?,during the early stages of growth
is TMS 30572 cassava variety popular in nigeria?,2177
What is the best chemical for the treatment of bean seeds?,"Thiram: This is a fungicide that is used to protect bean seeds against various soil-borne diseases, including Fusarium and Rhizoctonia"
why should we have more livestock on the grazzing ground?,their movement and their waste and their relentless chomping stimulate grasses to grow
why is crop cultivation a critical aspect of agriculture., plays a vital role in providing food security for the world's growing population.
what causes hunger?,poverty
name other chemicals used for seed dressing.,"imidacloprid, clothianidin, and thiamethoxam, which are neonicotinoid insecticides."
what are organic fertilizers.,"Organic fertilizers are made from natural materials such as compost, manure, and bone meal. They can provide a range of nutrients and help to improve soil structure and fertility over time."
what does excessive moisture causes.,root rot and other diseases
The primary macronutrients are?," nitrogen (N), phosphorus (P), and potassium (K), which are typically present in fertilizers in the form of NPK ratios"
which other conditions should be considered when planting maize in green house.,"In a greenhouse, it is important to provide the maize plants with adequate light, moisture, and nutrients. The greenhouse should be equipped with a suitable irrigation system to provide water to the plants, and fertilizers should be applied regularly to ensure proper growth and development."
what are Glueboards  used for?,for monitoring cockroaches and to catch rodents.
what activities are necessary for ensuring healthy and high-yielding cassava crops.," Regular weeding, fertilization, and pest and disease control measures"
how can climate affect soil fertility.,"Temperature, rainfall, and other weather factors can affect the rate of nutrient release from fertilizers and the growth and development of crops. For example, high temperatures and low rainfall can lead to rapid nutrient leaching and reduced nutrient availability, while cool temperatures and adequate rainfall can promote nutrient uptake and plant growth"
What are the symptoms of cassava mosaic,"Leaves leaves become distorted and yellow, Poor formation of tubers, The plants is stumted, Mosaic mottling,mishapen and twisted leaflets and reduction in size of leaves"
"
How does farm yard manure keep moisture in soil?"," improve soil moisture retention by increasing the soil's water-holding capacity, improving soil structure, and reducing soil erosion."
what is the botanical name for cassava mealybug,Phenacoccus manihoti
Which fertilizer is good for planting beans?," a fertilizer with a higher ratio of phosphorus and potassium, such as 10-20-20 or 15-30-15, would be suitable for planting beans"
what is Livestock management.,"involves taking care of different animals that are raised for various purposes, such as meat, milk, wool, and eggs."
how can sandy soil be improved.,"sandy soil can be improved by adding organic matter such as compost or manure, which can help to retain moisture and nutrients."
which fertilizer is advisable to be used during the flowering and grain filling stage., GoldChance super flowers &fruit fertilizer or with DIMIPHITE
define Genetically modified organisms.,are organisms whose genetic material has been altered by genetic engineering techniques generally known as recombinant DNA technology
what Crop residues can be used to make farmyard manure.,"maize stalks, bean stems, and rice straw"
what is the minimum soil depth required for growing cassava,30 cm
which two countries are the largest trading partners of the U.S,China and Canada
what is Payment for ecosystem services., is a method of providing additional incentives to encourage farmers to conserve some aspects of the environment
which human activities causes drought.," over-extraction of groundwater, water pollution, and inefficient water use can exacerbate drought conditions and reduce the availability of water for agriculture, industry, and domestic use"
what is farmyard manure.,"Farmyard manure (FYM), also known as organic manure or compost, is a mixture of animal waste, plant residues, and other organic materials that have been decomposed by microorganisms"
what is Food Supply Continuum,The process of getting food from the farm to the table
Which crops are most susceptible to armyworm infestation in Uganda?,"maize, sorghum, millet, and rice"
How can i store beans safely?,"Clean and dry the beans: Remove any debris, dirt or broken beans. Then, spread them out on a clean, dry surface, like a tarp or a concrete floor, to dry. Make sure they are completely dry before storing them."
what is the effect of applying too much fertilizers.,"can lead to reduced phosphorus and potassium uptake by crops, while applying too little can lead to nutrient deficiencies and reduced crop yields"
"Any maize markets out there?
",Nakasero Market
which other can i control the buying of fake agrochemicals.,"Always check the product labels carefully to ensure that the agrochemical is registered by the relevant authorities and has the correct dosage and usage instructions. Fake products often have misspelled words, unclear labels, or no label at all."
what is another name for cassava whitefly.,Bemisia tabaci
which type of cancer are high among agricultural workers.,"Leukemia, Non?Hodgkin lymphoma and skin cancer "
what is the use  autonomous crop robots.,harvest and seed crops
name Spodoptera exempta species that have chisel-like mandibels.," S. triturata, S. m. mauritia, S. m. acronyctoides, S. umbraculata, S. cilium, Spodoptera depravata [sv], and S. pecten"
Can over boiling maize make it loss Carbohydrates?," Boiling maize grains does not significantly affect the carbohydrate content, so the length of time for boiling is not critical for this nutrient."
name one open-pollinated maize variety that was developed in West Africa and is well-suited to drought-prone regions.,SAWAH
where are the south americans beetles,South America
what percentage does the production of animal food produce to Green House Emission.,57%
how is farmyard manure derived?,"Farmyard manure is typically derived from animal waste, such as cow dung, and contains a mix of organic matter, nutrients, and microorganisms. It provides a slow-release source of nutrients and helps improve soil structure and moisture retention."
"Is buying organic food better for the environment than buying food
produced conventionally?
","Ultimately, environmental sustainability comes down to the farmer, whether they produce goods organically or conventionally."
What is the best season for beans?,"beans prefer warm weather, plant at least a week after the last spring frost"
which animal require a diet that is lower in protein but higher in carbohydrates.,pigs 
Do agricultural exports help the economy? ,"According to the USDA Economic Research Service, $140.5 billion worth of American agricultural products were exported around the globe in 2017"
how can farmers control bacterial blight.," it's important to use disease-free planting material, practice good sanitation by regularly removing and destroying infected plant material, control insect vectors, and avoid working in cassava fields when plants are wet"
define embryo dormancy?,occurs when the embryo is immature and unable to germinate even under favorable conditions
what is the best spacing for cassava.,a distance of 1-1.5 meters between rows and 0.75-1 meter between plants
how is threshing done.,"achieved through rubbing, stripping, or impact action, or using a combination of these actions. The operation can be performed manually (trampling, beating), using animal power, or mechanical threshers"
what is harvesting,It involves removing the mature crops from the field and preparing them for storage or transport
how do the moths migrate?,"migration is based on winds brought by the Intertropical Convergence Zone, which move northwards or southwards depending on the season"
which tool can be used to cut cassava stems.,machete 
Are we losing family farms because corporate farms are taking over American Agriculture?,America�s farms are still family farms
which region has adopted automatic milking system.,Northern Europe
which other pest management practices can help to prevent and control green mite infestations,"nclude crop rotation, use of resistant varieties, and maintaining proper plant nutrition and moisture levels."
What pesticide can i apply when beans flower.,"When beans are flowering, it is important to be careful when applying pesticides as it can harm pollinators such as bees that help in the fertilization process. If you need to apply a pesticide during this time, it is recommended to use an insecticide that is safe for bees, such as those based on Bacillus thuringiensis (Bt), spinosad, or neem oil."
what is the maturity days for bush beans,50-55 days
How should the soil be prepared before planting beans?, the soil must be prepared by removing weeds and incorporating organic matter such as compost or manure to improve soil fertility.
"which pest feeds on the leaves and stems of cassava, causing defoliation and reduced yield",Cassava beetle
What is the organic name for cassava.,Manihot esculenta
which tools can farmers use to monitor water patterns in order to guard against drought.,"hey can use tools such as soil moisture sensors, weather stations, and remote sensing to gather information on conditions in their fields."
What is the importance of the storage organs to plants,"Storage organs, such as tubers, bulbs, and rhizomes, act as reservoirs for storing nutrients. These organs accumulate and store carbohydrates, proteins, and other essential nutrients during periods of active growth. The stored nutrients can be utilized by the plant during periods of dormancy, unfavorable conditions, or for supporting new growth."
which maize variety was developed by the International Maize and Wheat Improvement Center (CIMMYT).,CML444
how does proper seed bed preparation helps to control weeds.," by uprooting or burying weed seeds and removing existing weeds. By creating a clean and weed-free seed bed, farmers can minimize competition between weeds and crops for nutrients, water, and sunlight, leading to better crop establishment and growth."
What causes cassava seedling blight?,Xanthomonas axonopodis pv. manihotis is the pathogen that causes bacterial blight of cassava
"what nutrients can i use for water regulation, disease resistance, and stress tolerance in plants.",potassium 
How can agronomist overcome problems due to persistent use of fertilizers? ,"Regular soil testing helps determine the nutrient levels in the soil and allows for tailored fertilizer recommendations. Agronomists can assess the nutrient needs of specific crops and apply fertilizers accordingly, avoiding over-application. This helps maintain nutrient balance and prevents nutrient imbalances or excesses."
why has Food and Drug Administration has approved  the use of antibiotics in treating animals?,"to treat disease in animals that are sick, control disease for a group of animals when some of the animals are sick and to prevent disease in animals that are at risk for becoming sick"
what is Poaceae.,Poaceae is a family of flowering grasses which includes cereal grasses and the grasses of grasslands and pastures
what is the importance of drying seeds in relation to facilitating efficient storage and handling.," Dried seeds are easier to handle, store, and transport compared to seeds with higher moisture content. Lower moisture levels reduce the likelihood of seed clumping, mold formation, and damage during storage. Dry seeds also tend to have better flowability, making it easier to measure, package, and distribute them."
Apart from naro where else can we get access to quality seeds/cuttings?,Agricultural research organizations
Is there difference between fresh and dry maize in  terms of the food value.,"Yes, there are differences between fresh and dry maize in terms of their food value. Fresh maize, also known as sweet corn, is harvested when the kernels are still tender and contain a high amount of sugar. Dry maize, on the other hand, is left on the stalks to dry and mature, resulting in hard, starchy kernels."
How can i know that soil lacks air as a major nutrient,"To determine whether soil lacks air, you can perform a simple test called the squeeze test. Take a handful of soil and squeeze it tightly in your hand. If the soil remains in a tight ball and does not crumble, it may indicate that the soil is too compacted and lacks adequate air. Another indicator of soil lacking air is the presence of waterlogged areas or standing water after rain or irrigation."
what is the purpose of threshing .,The purpose of the threshing process is to detach the grain from the panicles
what are some of the symptoms  and signs of CAD,"small, circular, water-soaked spots on leaves that expand into larger, dark brown or black lesions. Infected leaves may become distorted and dry up"
What are some common pests that can affect maize crops?,"corn borers, armyworms, and rootworms"
