question,answers
in which areas are irrigation done.,areas with low rainfall or unreliable water sources.
which soil organism play a critical role in nutrient cycling.,"bacteria and fungi,"
how is Cassava Anthracnose Disease (CAD)  spread?,"CAD is spread through infected planting material, contaminated soil, and water"
what other factors make whitefly to multiply faster.,"Whiteflies have a relatively short life cycle, with adults living for only a few weeks. This means that multiple generations can occur within a growing season, allowing populations to increase rapidly.
"
name two types fertilizers.,organic and inorganic fertilizers
What are the measures farmers can take minimize crop losses during storage," Harvesting crops at the right time and in the right way is important to ensure that they are not damaged during the process. The crops should be harvested when they are mature but not overripe, and the tools used should be in good condition to prevent damage to the crops."
How long does cassava takes to mature.," It takes between 8 to 18 months to mature, depending on the variety"
what causes blight?,blight 
How has farming changed in the United States?,"The growth of farming brought many laborsaving devices to 19th- and early 20th-century farm life, including reaping and threshing machines, which replaced work done by hand. Today, with modern methods of agriculture that include complex machinery, scientific breeding, and chemical pesticides, farms require far fewer workers."
what happens to African armyworms first after emerging from pupation,hey allow their bodies to dry off and their wings to harden before climbing trees
where do armyworms lay their eggs., clusters on the lower side of leaves
What is Consumptive water use?,is the term that describes water used and not returned to the original source. 
"When is the best time to harvest beans, and how is this determined?",when the pods turn yellow and dry up
How can a farmer control bean weevil in the store?,"Cleaning and hygiene: Before storing beans, ensure that the storage area is clean and free from debris and residues that may harbor pests. Thoroughly clean the storage containers or structures to remove any existing infestations.

Proper storage containers: Use airtight containers, such as metal or plastic bins with tight-fitting lids, to store beans. This helps prevent weevils from entering and infesting the beans. Avoid using jute bags or other porous materials that can allow pest entry.

Temperature control: Weevils thrive in warm temperatures. Keeping the storage area cool can help deter their growth and reproduction. Maintain a temperature below 15 degrees Celsius if possible.

Moisture control: Weevils require moisture to survive and reproduce. Ensure that the beans are properly dried before storage to reduce moisture content. Use moisture-absorbing substances like silica gel packets or dry ash in the storage containers to keep the environment dry.

Natural repellents: Some natural substances act as repellents to weevils. These include dried neem leaves, mint leaves, or tobacco leaves. Place small sachets of these repellents in the storage containers to deter weevils.

Freezing or heating: If feasible, beans can be subjected to extreme temperatures to eliminate weevils. Freezing the beans for a few days at temperatures below -18 degrees Celsius or heating them at temperatures above 60 degrees Celsius can kill the pests.

Regular monitoring: Regularly inspect the stored beans for signs of weevil infestation, such as holes in the beans or presence of adult weevils. If infestation is detected, separate and discard the infested beans to prevent further spread."
which type of family do green manure crops belongs to.,leguminous
what is final stage in crop cultivation,Harvesting
How long should maize grains to be boiled for it's effective nutrients in human consumption.,"Maize grains can be boiled until they are tender, which usually takes around 30 to 45 minutes, depending on the variety and maturity of the maize. However, the length of time that maize grains should be boiled for optimal nutrient retention can vary depending on the specific nutrient in question."
what is root rot disease.," This is a fungal disease that causes the roots of the cassava plant to rot, leading to stunted growth and reduced yield"
how do apply fertilizers using top-dressing method.,"To apply fertilizer using the top-dressing method, you should first prepare the fertilizer by calculating the recommended dosage according to the soil analysis results and the crop requirements. Then, carefully spread the fertilizer evenly around the base of each plant, taking care not to damage the plant roots. After applying the fertilizer, you can use a hoe or other tool to gently scratch the soil surface to incorporate the fertilizer into the soil."
why are maize planted in rows.,it also allows for planting of other crops between these rows to make more efficient use of land space
what is Tillage.," is the practice of breaking up the soil with tools such as the plow or harrow to prepare for planting, for nutrient incorporation, or for pest control."
"I was told that for quickly germination of maize seeds, it needs first to be shocked in water before planting, is that true?","No, it is not necessary to shock maize seeds in water before planting for quicker germination. Maize seeds generally do not require pre-soaking before planting. They are capable of germinating under favorable soil conditions without any pre-treatment."
what are Pyrethroids pesticides.,"Pyrethroids are a type of synthetic pesticide that can be effective against a range of insect pests, including bean beetles and leafhoppers. They work by attacking the nervous system of insects. Pyrethroids are available in various forms, including sprays, dusts, and granules."
when do moths travel?,during the day
why do farmers don not like stake method of planting.,it requires more labor and resources to establish the nursery bed
name any one example of forest pest., bark beetles
what other measures can be used to control CAD?,Sanitation
How has agricultural automation stimulated employment.,by allowing producers to expand production and by creating other agrifood systems jobs
"which  social insects live in large colonies in the soil and feed on wood, plant matter, and other cellulose-containing materials.",Termites 
How can i know that soil lacks air as a major nutrient,"To determine whether soil lacks air, you can perform a simple test called the squeeze test. Take a handful of soil and squeeze it tightly in your hand. If the soil remains in a tight ball and does not crumble, it may indicate that the soil is too compacted and lacks adequate air. Another indicator of soil lacking air is the presence of waterlogged areas or standing water after rain or irrigation."
Is beef a healthy protein option?,serving of beef provides 10 essential nutrients including vitamins B6 and B12 and about half the daily requirement of protein.
what is the long term control measures for the cassava diseases.,using disease-resistant cassava varieties
give other examples of ruminats,"Goats, sheep, camels, and antelope "
what is a test dig?,dig to check if the tubers are ready for harvesting
Suggest the disadvantages of sandy  soil,"Poor water-holding capacity: Sandy soils have a low water-holding capacity, which means that they require more frequent irrigation and may not be suitable for crops that require consistent soil moisture.
Low nutrient retention: Sandy soils have low nutrient retention capacity, which can lead to leaching of nutrients and require more frequent application of fertilizers and organic matter.
Low organic matter content: Sandy soils are often low in organic matter, which can lead to soil erosion and reduced soil fertility.
Susceptible to erosion: Sandy soils are prone to erosion by wind and water, which can lead to soil degradation and loss of topsoil."
what is the impact of Intensive tillage.,"Intensive tillage can disrupt soil structure, reduce soil organic matter, and increase soil erosion, which can all lead to reduced soil fertility over time."
what causes Pythium Root Rot disease.,soil-borne fungus that thrives in wet and poorly drained soil
what farming technique is used to supplement rainfall in areas of low rainfall.,irrigation 
name some of the common water management practices,"soil moisture monitoring, crop water requirements estimation, crop selection, and crop rotation."
what is the importance of drying seeds in relation to facilitating efficient storage and handling.," Dried seeds are easier to handle, store, and transport compared to seeds with higher moisture content. Lower moisture levels reduce the likelihood of seed clumping, mold formation, and damage during storage. Dry seeds also tend to have better flowability, making it easier to measure, package, and distribute them."
"how does precision agriculture technologies, such as remote sensing, soil sensors, and variable-rate application systems help farmers and agronomist.",allow agronomists to optimize fertilizer use by applying nutrients precisely where and when they are needed. This helps reduce wastage and environmental impact.
How do you call the young ones of a horse,foal
what other factors make whitefly to multiply faster.,"Whiteflies have a relatively short life cycle, with adults living for only a few weeks. This means that multiple generations can occur within a growing season, allowing populations to increase rapidly.
"
what is the use of vitamin B6?,B6 is related to metabolism and immune function as well as brain development during pregnancy
what advise has been to farmers in uganda about CBSD.,"Farmers in Uganda have been advised to use clean and disease-free planting materials, adopt good agronomic practices, and plant resistant varieties to control CBSD."
why should Livestock receive appropriate veterinary care.,to ensure they remain healthy and productive
"name the processes in cassava growing,","land preparation, planting, weeding, harvesting, and processing"
what is the importance of agriculture.," It creates jobs, helps our economy and provides our basic necessities"
which insecticides are effective against caterpillars,Bt-based insecticides
what is the botanical name for cassava mealybug,Phenacoccus manihoti
how is biological pest control done?,involves the introduction of natural enemies of the pest that are bred in the laboratory and released into the environment.
which substance is applied in acidic soil to balance soil PH.,lime
What fertilizer is recommended for maize at planting stage?,"For maize at the planting stage, a fertilizer high in phosphorus (P) is recommended. Phosphorus plays a crucial role in promoting root development and early plant establishment. One commonly used fertilizer for maize at planting is diammonium phosphate (DAP), which typically has a ratio of 18-46-0, indicating 18% nitrogen (N), 46% phosphorus (P), and no potassium (K). This fertilizer provides a readily available source of phosphorus for the young maize plants.
"
which body oversees organic certification>,USDA National Organic Program (NOP)
what are the negative consequences of fertilizers for the environment.,pollution of waterways and harm to aquatic ecosystems.
why do farmers prefer cassava stem to cassava seeds.,Reduced risk of disease transmission
when do primary outbreaks occurs?,"occur with relatively inconspicuous, low-density populations that can survive without frequent rainfal"
Is there any cassava variety suitable for a particular region in Uganda?,There is no single cassava variety that is suitable for all regions in Uganda due to variations in climatic conditions and soil types.
what cultural methods are involved when eradicating whiteflies.,"Cultural control methods involve practices such as crop rotation, sanitation, and the use of reflective mulches, which can help to reduce whitefly populations by creating unfavorable conditions for their growth and reproduction."
what is Field inspection.,"An inspection of a seed field for carrying out checks to ascertain correct crop rotation,
isolation, rouging, weeding or compliance to seed quality standards"
what is monoculture.,one cultivar is planted on a large acreage
what factors contribute to the spread of CMD.,"Viral infection: The disease is caused by the presence of begomoviruses, particularly African cassava mosaic virus (ACMV) and East African cassava mosaic virus (EACMV). These viruses infect cassava plants and cause characteristic symptoms.

Vector transmission: Whiteflies feed on the sap of infected cassava plants, acquiring the virus. When they subsequently feed on healthy plants, they transmit the virus, leading to new infections. The whiteflies are efficient vectors and can quickly spread the disease within a cassava-growing area."
name the application of the cassava glue.,"paper mache, bookbinding, and woodworking"
how can farmers ensure proper drainage.,Ensuring that fields are properly drained can help to reduce the risk of infection.
What are genetically modified organisms (GMOs)?,GMOs are defined as �organisms in which the genetic material (DNA) has been altered in a way that does not occur naturally.
what are some of the high risk of work-related hazards that can affect farmers.,"injuries, lung disease, noise-induced hearing loss, skin diseases, as well as certain cancers related to chemical use and prolonged sun exposure"
at what stage does cassava requires about 500 to 750 mm of rainfall.,maturation stage
How can Rogueing be used to control CBSD.,Infected plants should be identified and removed from the field to prevent the disease from spreading
Is agriculture a luxury or a matter of national security?,American agriculture is a matter of national security
How is the height of a horse measured?,A horse�s height is measured in hands from the ground to the withers (the area on top of a horse between its neck and back)
What is the reason as cassava is called staple food,"Cassava is high in carbohydrates, with around 38-40% of its dry weight consisting of starch. This makes cassava an important source of energy for people who rely on it as a staple food."
What are some of biological properties of soil that soil scientists study?, microbial communities that live in the soil and the interactions between these organisms and the plants that grow in the soil.
Name the various activities done during crop cultivation.,"land preparation, planting, weed and pest control, fertilization, irrigation, harvesting, and storage"
What are the problems facing farming organization in uganda?,"Limited access to finance: Many farming organizations in Uganda lack access to finance, which makes it difficult for them to invest in modern farming technologies, hire skilled workers, and expand their operations.

Limited access to markets: Many small-scale farmers in Uganda struggle to access markets to sell their products, which can result in low prices and limited income.

Climate change: Uganda is vulnerable to climate change, which can have a negative impact on crop yields and overall agricultural productivity.

Pest and disease outbreaks: Uganda has experienced several pest and disease outbreaks in recent years, such as the Fall Armyworm and Banana Bacterial Wilt, which can significantly reduce crop yields and income.

Limited access to extension services: Many farmers in Uganda lack access to extension services and technical assistance, which can limit their ability to adopt modern farming technologies and improve their farming practices.

Land tenure insecurity: Land tenure insecurity is a common challenge in Uganda, particularly for small-scale farmers, which can limit their ability to invest in their farms and access credit.

Poor infrastructure: Poor infrastructure, including inadequate roads, storage facilities, and irrigation systems, can limit the ability of farming organizations in Uganda to transport their products, store them properly, and irrigate their crops during dry spells."
which maize variety was developed by the International Maize and Wheat Improvement Center (CIMMYT).,CML444
"name the processes in cassava growing,","land preparation, planting, weeding, harvesting, and processing"
how are cover crops used in agroecosystem where water for crop production is in short supply, cover crops can be used as a mulch to conserve water by shading and cooling the soil surface
which region has adopted automatic milking system.,Northern Europe
Can eating a genetically modified fruit or vegetable change a person’s genes?,Eating GMO products does not impact our genes. 
when does the differences in appearance between the solitaria and gregaria phases become apparent.,in the third instar and remain until the last instar
what is Poaceae.,Poaceae is a family of flowering grasses which includes cereal grasses and the grasses of grasslands and pastures
how is threshing done.,"achieved through rubbing, stripping, or impact action, or using a combination of these actions. The operation can be performed manually (trampling, beating), using animal power, or mechanical threshers"
how can farmers benefit from farmers organization,"Knowledge and information sharing: Farming organizations often serve as platforms for knowledge and information exchange among farmers. They provide access to training programs, workshops, seminars, and demonstrations on various agricultural practices, technologies, and market trends. This helps farmers stay updated on the latest farming techniques, best practices, and innovations, enabling them to improve their skills and productivity.

Collective bargaining power: By joining together in a farming organization, farmers can collectively negotiate better prices for their produce and access to inputs, such as seeds, fertilizers, and machinery. The organization can act as a unified voice, representing the interests and concerns of farmers to government authorities, agribusinesses, and other stakeholders, leading to improved market access and fairer trade terms.

Access to financial resources: Farming organizations can facilitate access to credit and financial resources for farmers. They may partner with financial institutions or develop their own revolving funds to provide affordable loans, savings schemes, and insurance products tailored to farmers' needs. This helps farmers overcome financial constraints, invest in their farms, and manage risks associated with farming.

Market linkages and value addition: Farming organizations can establish market linkages and connect farmers with potential buyers, processors, and exporters. They may engage in collective marketing initiatives, bulk sales, or value addition activities, such as processing and packaging, to enhance the marketability and profitability of farmers' produce. This can lead to better market prices, increased income, and improved market access for farmers.

Advocacy and representation: Farming organizations often engage in advocacy and policy dialogue on behalf of farmers. They can influence agricultural policies, regulations, and practices to create a favorable enabling environment for farming. By representing farmers' interests, they can address challenges, promote sustainable farming practices, and advocate for policies that support the growth and development of the agricultural sector.

Networking and collaboration: Being part of a farming organization allows farmers to network and collaborate with peers, experts, researchers, and other stakeholders in the agricultural sector. This fosters learning, collaboration, and innovation, as farmers can share experiences, exchange ideas, and collaborate on research, projects, and initiatives that benefit the farming community as a whole."
which caterpillar pests  can cause significant damage to cassava crops.,Armyworms 
"which pest feeds on the underside of the cassava leaves, causing them to turn yellow and dry up",Cassava green mite
what is Land transformation.,the use of land to yield goods and services
Why my beans are geminating with yellow leaves.,"Yellowing leaves can be a sign of nutrient deficiency, particularly nitrogen. Beans require an adequate supply of nitrogen for healthy growth. If the soil lacks nitrogen or other essential nutrients, it can result in yellowing leaves."
what percentage does the production of animal food produce to Green House Emission.,57%
How can clay soil be improved?,"Both sandy and clay soils have unique characteristics that can make it challenging to sustain a variety of crops. However, there are several ways in which the properties of these soil types can be improved to make them more fertile and productive for crop growth. Add organic matter, user cover crops,crop rotation, use of soil amendments."
what is monoculture.,one cultivar is planted on a large acreage
how else can you achieve pest control.,culling
which population is vulnerable  in agriculture.,Ages 0�6
what are green manure used for?,to manage a range of soil macronutrients and micronutrients
What bean variety fetch high price on market?,"Kidney beans (Phaseolus vulgaris): They are large, kidney-shaped beans with a smooth texture and a rich, meaty flavor. They are often used in chili, soups, and stews.

Black beans (Phaseolus vulgaris): These beans have a dense, creamy texture and a slightly sweet, earthy flavor. They are commonly used in Latin American and Caribbean cuisine.

Pinto beans (Phaseolus vulgaris): They are medium-sized beans with a speckled appearance and a creamy texture. Pinto beans are popular in Mexican and Southwestern cuisine.

Navy beans (Phaseolus vulgaris): These small, white beans have a mild flavor and a smooth texture. They are often used in baked beans and soups.

Cannellini beans (Phaseolus vulgaris): These Italian white beans have a creamy texture and a mild, nutty flavor. They are commonly used in Mediterranean dishes."
Which condition is suitable for maize plantation,"Maize thrives in warm temperatures and requires an average temperature of 21-27�C during the growing season. It also requires a good amount of sunshine, ideally 8-10 hours of sunlight per day. Maize grows well in well-drained soils with good water retention capacity. The soil should have a pH of 5.5 to 7.5. Maize also requires sufficient rainfall or irrigation during the growing season. The recommended altitude for planting maize is between 0 and 2500 meters above sea lev"
how long should the cassava stem be cut?,20-30 cm long
what are some of the pest management practices for armyworm.,"planting cassava in well-drained soil, maintaining a healthy crop by providing adequate water and nutrients, and rotating crops to reduce armyworm populations."
What are the measures farmers can take minimize crop losses during storage," Harvesting crops at the right time and in the right way is important to ensure that they are not damaged during the process. The crops should be harvested when they are mature but not overripe, and the tools used should be in good condition to prevent damage to the crops."
is TMS 30572 cassava variety popular in nigeria?,2177
what is mulching.,covering the soil around the cassava plants with a layer of organic material such as leaves or straw.
