question,answers
"What is the name of the disease that causes faint, light brown discoloration beneath the skin of fruits in Apple trees?","Bitter rot, caused by Glomerella cingulata, is the disease that causes faint, light brown discoloration beneath the skin of fruits in Apple trees."
How often and how much should I water my citrus trees?,"Citrus trees need regular watering, especially during dry periods and fruit development. They prefer deep, infrequent watering to encourage deep root growth. Adjust irrigation based on soil moisture levels and weather conditions."
What management practices can be implemented to control cercospora leaf spot in chilli plants?,Spray twice at 10-15 days intervals with Mancozeb at 0.25% or Chlorothalonil (Kavach) at 0.1%.
What are the symptoms of Anthracnose in bananas?,"The skin at the distal ends of the fingers turns black and shrivels. The fungus produces masses of conidia which form a pinkish coat. In severe cases, the entire fruit and bunch is affected."
"How much water do grapevines need, and how often should I irrigate?","Grapevines require regular irrigation, especially during the growing season and fruit development. The frequency and amount of irrigation depend on factors like soil type, climate, and stage of growth."
What factors favor infection by Pythium aphanidermatum in chilli plants?,"Factors favoring infection include moist soils, poor drainage, high relative humidity (90-100%), and soil temperature around 20°C."
What are the key aspects of the epidemiology of Pythium root rot?,The fungus is mainly soil-borne and thrives in poorly drained conditions with stagnant water. High soil moisture or continuous rain can accelerate the development of the disease.
