question,answers
"As a farmer, how can I control pigweeds in the garden?",Weed when pigweeds are young and spray them if necessary to effectively control their growth in the garden.
What method is recommended for controlling pigweeds in the garden by farmers?,"Farmers are recommended to weed when pigweeds are young and, if necessary, spray them to effectively control their growth in the garden."
How should farmers manage pigweeds in the garden effectively?,Effective management of pigweeds in the garden involves weeding when they are young and spraying if necessary to control their growth.
"As a farmer, how can I know the qualities of a good fertilizer?",Farmers should check if the chemical composition of the fertilizer can sustain crop production well and meet the nutritional needs of the crops.
What criteria can farmers use to assess the quality of fertilizers?,Farmers can assess the quality of fertilizers by checking if their chemical composition supports crop production and meets the nutritional requirements of the crops.
How can farmers determine the suitability of fertilizers for their crops?,Farmers can determine the suitability of fertilizers by ensuring their chemical composition supports crop production and meets the nutritional needs of the crops.
At what stage of maize growth should I apply the fertilizer?,Apply fertilizer around planting time in the soil and on the foliage at the vegetative stage before flowering for optimal nutrient uptake by the maize plants.
When should farmers apply fertilizer to maize crops for optimal growth?,Farmers should apply fertilizer around planting time in the soil and on the foliage at the vegetative stage before flowering to ensure optimal nutrient uptake by the maize plants.
At what stage should I weed the beans?,Weeding should be done three weeks after planting beans to prevent competition for nutrients and ensure proper growth.
When is the optimal time for weeding beans?,The optimal time for weeding beans is approximately three weeks after planting to avoid nutrient competition and promote healthy growth.
At what time should I spray armyworms in maize?,"Cultural methods should be used to control armyworms in maize, and spraying should be done when necessary according to pest population levels."
At what time should a farmer do watering crops?,Watering crops should ideally be done in the evening to minimize water loss due to evaporation and ensure effective absorption by the plants.
When is the best time for farmers to water their crops?,The best time for farmers to water their crops is in the evening to minimize water loss through evaporation and ensure optimal absorption by the plants.
Brown streak is a disease but how better can prevent it?,Planting clean material free from infection and using disease-resistant varieties can effectively prevent brown streak disease in cassava.
By which means does cassava reproduce?,"Cassava reproduces through stem cuttings, which are planted to grow new cassava plants after pollination."
What method does cassava primarily use for reproduction?,"Cassava primarily reproduces through stem cuttings, which are used to propagate new cassava plants."
Can I use chemicals to control weeds when beans are just germinating?,"No, using herbicides at this stage can kill the young beans along with the weeds, leading to crop loss."
Is it advisable to use herbicides for weed control when beans are in the germination stage?,"No, it is not advisable to use herbicides for weed control when beans are germinating because the young bean plants may also be killed, resulting in crop loss."
When is it appropriate to apply herbicides for weed control in bean fields?,Herbicides should be applied for weed control in bean fields when the beans have sufficiently established and are less susceptible to damage from herbicide application.
At what stage of bean growth should herbicides be applied for weed control?,"Herbicides should be applied for weed control in bean fields when the beans have reached a growth stage where they are less likely to be affected by herbicide application, typically after they have germinated and established."
How can farmers effectively manage watering schedules for their crops?,Farmers can effectively manage watering schedules for their crops by irrigating in the evening to minimize water loss through evaporation and ensure optimal absorption by the plants.
What practices can farmers adopt to optimize crop watering?,Farmers can optimize crop watering by scheduling irrigation in the evening to minimize water loss and maximize absorption by the plants.
How can farmers adjust their watering practices to enhance crop growth?,Farmers can enhance crop growth by watering their crops in the evening to minimize water loss and facilitate effective absorption by the plants.
When should farmers spray for armyworms in maize fields?,"Farmers should spray for armyworms in maize fields when necessary based on pest population levels, prioritizing cultural methods of control."
What is the recommended approach for controlling armyworms in maize?,"The recommended approach for controlling armyworms in maize is to primarily use cultural methods, resorting to spraying only when necessary based on pest population levels."
What measures can farmers take to prevent brown streak disease in cassava?,Farmers can prevent brown streak disease in cassava by planting clean material free from infection and selecting disease-resistant varieties.
What are effective strategies for preventing brown streak disease in cassava?,Effective strategies for preventing brown streak disease in cassava include planting clean material free from infection and choosing disease-resistant varieties.
How does cassava propagate new plants?,"Cassava propagates new plants through stem cuttings, which are taken from mature plants and planted to grow new cassava plants."
What method does cassava primarily use for reproduction?,"Cassava primarily reproduces through stem cuttings, which are harvested from mature plants and planted to grow new cassava plants."
What should farmers avoid when controlling weeds during bean germination?,"Farmers should avoid applying herbicides for weed control during bean germination to prevent the accidental killing of young bean plants along with the weeds, which could lead to crop loss."
Can I use chemicals to kill weeds in a cassava garden?,"Yes, there are some chemicals that are selective and can effectively kill weeds in a cassava garden without harming the cassava plants."
Are there chemical options available for weed control in cassava fields?,"Yes, certain herbicides are designed to target weeds selectively, making them suitable for weed control in cassava fields without causing harm to the cassava plants."
Is it possible to use herbicides for weed management in cassava cultivation?,"Yes, herbicides can be used to manage weeds in cassava cultivation, provided they are applied correctly to avoid damage to the cassava plants."
Can cassava seeds germinate if planted?,"No, cassava does not produce seeds, so it is propagated through stem cuttings rather than seeds."
Is cassava propagated through seeds or other means?,"Cassava is propagated through stem cuttings rather than seeds, as it does not produce viable seeds for germination."
How does cassava reproduce to form new plants?,"Cassava reproduces through stem cuttings, where sections of the stem are cut and planted to grow into new cassava plants."
Can stem cuttings affected by hailstorm have good yield?,"No, stem cuttings affected by hailstorms may have reduced vigor and yield, leading to lower productivity."
Do hailstorms affect the productivity of cassava stem cuttings?,"Yes, hailstorms can damage cassava stem cuttings, resulting in reduced vigor and yield potential, thus lowering productivity."
What impact does hailstorm damage have on the yield of cassava stem cuttings?,"Hailstorm damage to cassava stem cuttings can lead to reduced vigor and yield, resulting in lower productivity compared to undamaged cuttings."
Can the chemical used for storing affect seed germination?,"No, it does not affect germination"
Does the type of chemical used for storage affect the germination of seeds?,"No, the chemical used for storage does not typically affect seed germination."
Can spraying chemicals cause environmental pollution?,"Yes, spraying chemicals can lead to environmental pollution."
Is there a risk of environmental pollution when spraying chemicals?,"Yes, spraying chemicals can result in environmental pollution if proper precautions are not taken."
What are the potential environmental impacts of chemical spraying?,"Chemical spraying can cause environmental pollution, affecting air, water, soil, and wildlife if not properly managed."
Can spraying chemicals affect soil?,"Yes, especially uncontrolled spraying may kill non-targeted organisms, can damage soil biomass and microorganisms."
How can chemical spraying impact soil health?,"Chemical spraying can negatively affect soil health by killing non-targeted organisms, damaging soil biomass, and disrupting microorganism populations."
Cassava and maize which one makes a person stronger?,Both can depend on how much but cassava has more calories per kilogram.
"Between cassava and maize, which one provides more energy?",Cassava contains more calories per kilogram compared to maize.
Cassava and maize which one makes you stronger in food stuff?,"Cassava has more calories, while maize has more proteins."
"Which food item, cassava, or maize, provides better nutritional strength?","Cassava provides more energy due to its higher calorie content, while maize offers more protein."
Do I need to put the cassava stem in the sun for some time before planting?,"Yes, it stimulates sprouting."
Is it beneficial to expose cassava stems to sunlight before planting?,"Yes, exposing cassava stems to sunlight before planting stimulates sprouting, aiding in the establishment of new plants."
Do we have a selective pesticide for rodents?,No.
Is there a specific pesticide that targets only rodents?,"No, there is no selective pesticide designed specifically for rodents."
Can rodent pests be effectively controlled with selective pesticides?,"No, selective pesticides for rodents are not available."
What options are available for controlling rodent pests selectively?,Selective control methods such as traps and baits are commonly used to target rodent pests without harming other organisms.
"What is the disease known as damping off in chilli, and what is the causative pathogen?",Damping off in chilli is caused by Pythium aphanidermatum.
What is the scientific name of the pathogen responsible for damping off in chilli plants?,The scientific name of the pathogen causing damping off in chilli plants is Pythium aphanidermatum.
"What causes damping off in chilli seedlings, and what are its symptoms?","Damping off in chilli seedlings is caused by Pythium aphanidermatum. Symptoms include seedlings being killed before emergence, water soaking, and shriveling of the stem."
What environmental conditions favor infection by Pythium aphanidermatum in chilli plants?,"Factors favoring infection include moist soils, poor drainage, high relative humidity (90-100%), and soil temperature around 20°C."
How does soil moisture level affect the spread of damping off in chilli plants?,"Excess soil moisture, coupled with poor drainage, creates favorable conditions for Pythium aphanidermatum, leading to increased incidence of damping off in chilli plants."
What is the significance of soil temperature in the development of damping off in chilli plants?,"Soil temperature around 20°C provides an optimal environment for the growth and spread of Pythium aphanidermatum, contributing to the occurrence of damping off in chilli plants."
"What are the key characteristics of Pythium aphanidermatum, the pathogen causing damping off in chilli plants?","The mycelium is hyaline, coenocytic, and zoosporangia are lobed and branched. Zoospores are biflagellate, and oogonia are spherical with smooth walls. Antheridia are monoclinous, intercalary, or terminal. Oospores are aplerotic, single with a thick wall."
How does Pythium aphanidermatum differ from other pathogens affecting chilli plants?,"Pythium aphanidermatum is characterized by its hyaline mycelium, lobed and branched zoosporangia, and aplerotic, single oospores with thick walls, distinguishing it from other pathogens affecting chilli plants."
How does Pythium aphanidermatum spread and survive in chilli fields?,"The pathogen is soil-borne, and zoospores spread through irrigation water. The disease can spread to the main field by planting infected seedlings."
What are the primary modes of transmission for Pythium aphanidermatum in chilli fields?,"Pythium aphanidermatum primarily spreads through contaminated soil and irrigation water, along with the transplantation of infected seedlings into healthy fields."
What preventive measures can be taken to minimize the spread of damping off in chilli plants caused by Pythium aphanidermatum?,"Implementing proper sanitation practices, using pathogen-free planting material, and avoiding over-irrigation can help minimize the spread of damping off in chilli plants."
What management practices can be implemented to control damping off in chilli plants caused by Pythium aphanidermatum?,Soil drenching with Copper oxychloride at a concentration of 0.25% can be effective in managing damping off in chilli plants.
How effective is Copper oxychloride in controlling damping off in chilli plants?,"Copper oxychloride, when applied as a soil drench at a concentration of 0.25%, demonstrates efficacy in suppressing the growth and spread of Pythium aphanidermatum, thereby controlling damping off in chilli plants."
"Besides chemical treatments, what other strategies can be employed to manage damping off in chilli plants?","Implementing cultural practices such as improving drainage, using pathogen-free planting material, and maintaining proper soil moisture levels can complement chemical treatments in managing damping off in chilli plants."
"What is the disease known as fruit rot and die back in chilli, and what is the causative pathogen?",Fruit rot and die back in chilli is caused by Colletotrichum capsici.
What is the scientific name of the pathogen responsible for fruit rot and die back in chilli plants?,The pathogen responsible for fruit rot and die back in chilli plants is Colletotrichum capsici.
What are the common symptoms of fruit rot and die back in chilli plants?,"Symptoms include necrosis of tender twigs, flower drop, profuse shedding of flowers, shriveling of flower stalks, die-back of branches and stem, and necrotic areas on the soil surface separated by a dark brown to black band. Partially affected plants may bear few, low-quality fruits."
"What are the characteristics of Colletotrichum capsici, the pathogen causing fruit rot and die back in chilli plants?",The mycelium is septate and inter and intra-cellular. Conidia in mass appear pinkish and are borne singly at the tip of conidiophores.
How does Colletotrichum capsici spread and survive in chilli fields?,"The fungus is seed-borne, and secondary infection occurs by airborne conidia and rain. Spread can also occur through wind-blown rains during the rainy season, and flies and other insects can disseminate spores from one fruit to another. Seeds from badly diseased fruits may also carry the primary inoculum. The fungus may not survive long in soil but can survive on dead twigs stored under dry conditions."
What is the mode of transmission for Colletotrichum capsici in chilli fields?,"Colletotrichum capsici spreads through seed, airborne conidia, rain, wind-blown rains during the rainy season, and dissemination by flies and other insects. Seeds from badly diseased fruits may also carry the primary inoculum."
What management practices can be implemented to control fruit rot and die back in chilli plants caused by Colletotrichum capsici?,"Use of disease-free seeds is important. Seed treatment with Thiram or Captan at 4g/kg is effective in eliminating seed-borne inoculum. Good control of the disease has been reported by three sprayings with Ziram at 0.25%, Captan at 0.2%, or Miltox at 0.2%. Chemicals like wettable sulphur at 0.2%, copper oxychloride at 0.25%, and Zineb at 0.15% not only reduce disease incidence but also increase fruit yield. The first spraying should be given just before flowering, the second at fruit formation, and the third a fortnight after the second spraying."
How effective is seed treatment in controlling fruit rot and die back in chilli plants?,Seed treatment with Thiram or Captan at 4g/kg is effective in eliminating seed-borne inoculum of Colletotrichum capsici.
What are the recommended chemicals for spray application to control fruit rot and die back in chilli plants?,"Good control of the disease has been reported by three sprayings with Ziram at 0.25%, Captan at 0.2%, or Miltox at 0.2%. Chemicals like wettable sulphur at 0.2%, copper oxychloride at 0.25%, and Zineb at 0.15% not only reduce disease incidence but also increase fruit yield."
When should the first spraying of chemicals be applied to control fruit rot and die back in chilli plants?,The first spraying should be given just before flowering to control fruit rot and die back in chilli plants effectively.
What is the recommended timing for the second spraying of chemicals in chilli plants to control fruit rot and die back?,The second spraying should be applied at fruit formation stage for effective control of fruit rot and die back in chilli plants.
How many sprayings are recommended for optimal control of fruit rot and die back in chilli plants?,Three sprayings with recommended chemicals are suggested for good control of fruit rot and die back in chilli plants.
"What is the disease known as powdery mildew in chilli, and what is the causative pathogen?",Powdery mildew in chilli is caused by Leveillula taurica.
What is the scientific name of the pathogen responsible for powdery mildew in chilli plants?,The pathogen responsible for powdery mildew in chilli plants is Leveillula taurica.
What are the symptoms of powdery mildew in chilli plants?,Symptoms include shedding of foliage and the presence of white powdery growth on the lower side of leaves.
What is the life cycle of powdery mildew in chilli plants?,"The powdery mildew disease cycle starts when spores (conidia) land on a chilli leaf. Spores germinate and grow into the leaf, parasitizing the plant as a food source. After a latency period of 18-21 days, the fungus grows out of the breathing pores (stomates) on the underside of the leaf, producing spores borne singly on numerous, fine strands or stalks (conidiophores). These strands become visible as white patches or mildew colonies on the underside of the leaf. Repeated cycles of powdery mildew can lead to severe outbreaks that economically damage the crop."
How does powdery mildew spread and develop in chilli plants?,"Powdery mildew starts when spores land on a chilli leaf and germinate, growing into the leaf and parasitizing the plant. After a latency period, the fungus grows out of the breathing pores on the underside of the leaf, producing spores on numerous fine strands or stalks. These spores become visible as white patches or mildew colonies on the leaf's underside, and repeated cycles can lead to severe outbreaks damaging the crop economically."
What management practices can be implemented to control powdery mildew in chilli plants caused by Leveillula taurica?,Spray Wettable sulphur at 0.25% or Dinocap (Karathane) at 0.05% to control powdery mildew in chilli plants caused by Leveillula taurica.
How can powdery mildew in chilli plants be effectively managed?,Powdery mildew in chilli plants can be effectively managed by spraying Wettable sulphur at 0.25% or Dinocap (Karathane) at 0.05%.
What are the recommended chemicals for controlling powdery mildew in chilli plants?,Wettable sulphur at 0.25% or Dinocap (Karathane) at 0.05% are recommended chemicals for controlling powdery mildew in chilli plants.
"What is the disease known as bacterial leaf spot in chilli, and what is the causative pathogen?",Bacterial leaf spot in chilli is caused by Xanthomonas campestris pv. vesicatoria.
What is the scientific name of the pathogen responsible for bacterial leaf spot in chilli plants?,The pathogen responsible for bacterial leaf spot in chilli plants is Xanthomonas campestris pv. vesicatoria.
What are the symptoms of bacterial leaf spot in chilli plants?,"Symptoms of bacterial leaf spot in chilli plants include dark, water-soaked lesions on the leaves that later turn brown and necrotic."
What are the symptoms of bacterial leaf spot in chilli plants?,"Symptoms include small circular or irregular, dark brown or black greasy spots on leaves. As the spots enlarge, the center becomes lighter surrounded by a dark band of tissue. Severely affected leaves become chlorotic and fall off. Petioles and stems are also affected, leading to cankerous growth and wilting of branches. On fruits, round, raised water-soaked spots with a pale yellow border develop, which later turn brown and develop a depression in the center with shining droplets of bacterial ooze."
Describe the appearance of lesions caused by bacterial leaf spot in chilli plants.,"Lesions caused by bacterial leaf spot in chilli plants are small circular or irregular, dark brown or black greasy spots on leaves. As the spots enlarge, the center becomes lighter surrounded by a dark band of tissue."
What are the visible signs of bacterial leaf spot infection in chilli plants?,"Visible signs of bacterial leaf spot infection in chilli plants include the development of small circular or irregular, dark brown or black greasy spots on leaves, which enlarge over time. Severely affected leaves may become chlorotic and fall off, and on fruits, round, raised water-soaked spots with a pale yellow border develop, later turning brown with a depression in the center and shining droplets of bacterial ooze."
How does Xanthomonas campestris pv. vesicatoria spread and survive in chilli fields?,"Xanthomonas campestris pv. vesicatoria primarily spreads through seeds and in the nursery. It further disseminates with infected transplants, and spattering rains are the chief means of dissemination. The bacterium can also survive in infected debris."
What are the primary methods of dissemination for Xanthomonas campestris pv. vesicatoria in chilli fields?,"The primary methods of dissemination for Xanthomonas campestris pv. vesicatoria in chilli fields include seed transmission, spread in the nursery, dissemination through infected transplants, and transmission via spattering rains. Additionally, the bacterium can survive in infected debris."
How does bacterial leaf spot spread from one chilli plant to another?,"Bacterial leaf spot spreads in chilli plants primarily through contaminated seeds and infected transplants. It can also disseminate through spattering rains, which facilitate the spread of bacteria from one plant to another. Moreover, the bacterium can persist in infected debris, contributing to its survival and further spread."
What management practices can be implemented to control bacterial leaf spot in chilli plants?,"Management practices to control bacterial leaf spot in chilli plants include seed treatment with 0.1% mercuric chloride solution for 2 to 5 minutes, and spraying seedlings with Bordeaux mixture at 1% or copper oxychloride at 0.25%. Field sanitation is crucial, and seeds should be obtained from disease-free plants. It's important to note that spraying with streptomycin should not be done after fruits begin to form."
