question,answers
Which variety of dk maize is good in amolatar?,"DK 8033 is a maize variety that has been widely grown in Uganda, including in the Amolatar region"
What percentage did vitamin C in fresh broccoli dropped?, 50% within one week
which other field is RFID being used?,hay
What is the best way to store harvested wheat to prevent spoilage?,Harvested wheat should be stored carefully to prevent spoilage and maintain quality
name one chemical pesticides that can be applied to control termides.,termiticides
what chemical methods are used to control termites.,"baits, soil treatments, and wood treatments"
"which nutrient  is important for root development, flowering, and fruiting.",Phosphorus 
how can sandy soil be improved.,"sandy soil can be improved by adding organic matter such as compost or manure, which can help to retain moisture and nutrients."
why is Integrated Pest Management used?,"to minimize the use of pesticides and other chemicals, while still effectively controlling pests and diseases."
what is Tillage.," is the practice of breaking up the soil with tools such as the plow or harrow to prepare for planting, for nutrient incorporation, or for pest control."
what does the number 10-20-10 represent in  fertilizers.,"the numbers represent the percentage of N, P, and K, respectively"
 can delaying weeding cassava cause cassava mosaic,"Delaying weeding in cassava fields can create favorable conditions for the spread of Cassava Mosaic Disease (CMD). Weeds can act as alternative hosts for the whiteflies that transmit the virus responsible for CMD. When weeds are left to grow and multiply in the cassava field, they can attract whiteflies and serve as a reservoir for the virus. These whiteflies can then spread the virus to the cassava plants, leading to infection and the development of mosaic symptoms."
what are the negative consequences of fertilizers for the environment.,pollution of waterways and harm to aquatic ecosystems.
which part of cassava is affected by CBSD,roots
"Besides cow dung and urine, what does farmyard manure contain.",Animal bedding
what is the minimum soil depth required for growing cassava,30 cm
at what stage does the cutworms attack cassava?,during the early stages of growth
does harvesting maize early before its dried causes mycotoxin contamination?,"Maize that is harvested before it is fully dried is at a higher risk of mycotoxin contamination, which can pose health risks to both humans and animals if consumed."
Which agricultural method can be used to improve on soil fertility,fertilizer applications
how does seed drying prevent spoilage.," Drying seeds effectively reduces the risk of spoilage during storage. Moisture provides a favorable environment for the growth of microorganisms, such as fungi and bacteria, which can attack and damage seeds. By reducing moisture content through drying, farmers can inhibit the growth of these organisms and minimize the risk of seed spoilage and loss."
how can farmers ensure proper drainage.,Ensuring that fields are properly drained can help to reduce the risk of infection.
name two types of African armyworm outbreak.,primary and secondary
"During the mid to late vegetative stage, cassava requires less rainfall as it begins to store food in its roots. what is it?",about 750 to 1000 mm of rainfall.
how were the primitive milking machine used?,used hollow wheat stems inserted in the teats to milk cows
what causes blight?,blight 
How can I test for moisture in maize at a local level,"Hand Feel: Take a handful of maize kernels and squeeze them tightly in your hand. If the kernels feel hard and dry, it indicates low moisture content. If they feel slightly pliable or soft, it suggests higher moisture content.

Bite Test: Take a few kernels and try to bite into them. If they crack easily, it indicates lower moisture content. If they are chewy or squashy, it suggests higher moisture content.

Visual Inspection: Examine the appearance of the kernels. If they appear shriveled, discolored, or have damaged husks, it could indicate lower moisture content. If the kernels appear plump, shiny, and well-hydrated, it suggests higher moisture content.
"
how long does the cassava plant takes to mature.," between 9-24 months after planting, depending on the variety and the intended use of the crop"
how many bristles do female armyworms have?,females have multiple
what is Land transformation.,the use of land to yield goods and services
how is biodiversity enhanced through reliable rainfall.," Rainfall can support a variety of plant and animal species, leading to increased biodiversity and a healthier ecosystem.
"
define field capacity?,"This refers to the maximum amount of water the soil can hold after it has been thoroughly wetted and excess water has drained away. At field capacity, there is enough water in the soil for plants to use, but excess water has drained away, leaving air spaces in the soil."
name other chemicals used for seed dressing.,"imidacloprid, clothianidin, and thiamethoxam, which are neonicotinoid insecticides."
what depth should the cassava garden be ploughed to.,at least 25 cm
What is the process of field drying and threshing maize?,Post-harvest management
what biological method can a farmer use to control cassava whitefly.,"introduction of natural enemies of the whitefly,"
how can you control whiteflies,Whiteflies can be controlled using insecticides or by using sticky traps that attract and trap the insects.
which plant nutrient helps in formation of chlorophyll . , magnesium (Mg)
How are maize planted?,"the maize seeds are planted either by hand or machine, depending on the scale of the operation"
give other examples of ruminats,"Goats, sheep, camels, and antelope "
Can maize be grown in green house?,"Yes, maize can be grown in a greenhouse, but there are some important considerations to keep in mind."
how is threshing done for bean crops?,manually or by using machines such as threshers or combines
Can I eat healthy without spending a lot of money?,es. Food in the United States is very affordable
which organic fertilizer is good for cassava cultivation.,compost or animal manure
why are farmers encouraged to do proper seed bed preparation.,"Proper seed bed preparation creates a favorable environment for seed germination. It helps to loosen the soil, remove debris, and create a fine and level surface where seeds can make good contact with the soil, facilitating better seed-to-soil contact and increasing the chances of successful germination."
how do the moths migrate?,"migration is based on winds brought by the Intertropical Convergence Zone, which move northwards or southwards depending on the season"
what other measures can be used to control CAD?,Sanitation
why are farmers encouraged to do proper seed bed preparation.,"Proper seed bed preparation creates a favorable environment for seed germination. It helps to loosen the soil, remove debris, and create a fine and level surface where seeds can make good contact with the soil, facilitating better seed-to-soil contact and increasing the chances of successful germination."
name the first step in crop cultivation,Land preparation
what are Calcium-based fertilizers?,"Fertilizers that are high in calcium, such as calcium nitrate or calcium carbonate, can help improve soil structure and water-holding capacity. Calcium helps flocculate clay particles in the soil, creating larger pore spaces and improving drainage."
Does most of the money I pay for food go back to the farmer?,Not necessarily
Farmers always ask what do they do to store beans safely,"Clean the beans: Remove any debris or foreign matter from the beans, such as leaves, stones, or twigs. This can be done by hand or with a sieve.

Dry the beans: Spread the beans out on a clean, dry surface to allow them to dry completely. This will help prevent mold growth and spoilage.

Store in a cool, dry place: Beans should be stored in a cool, dry place with good air circulation, such as a pantry or a cool basement. Avoid storing them in a damp or humid environment, as this can promote mold growth.

Use airtight containers: Store beans in airtight containers such as plastic bags, glass jars or metal containers with tight lids. This will help keep out moisture and pests.

Check regularly: Check the beans regularly for signs of mold, moisture or insect infestation. If any beans appear damaged, remove them immediately to prevent further spoilage."
can the quality of maize harvest early before its dried be reduced?,"Maize that is harvested before it is fully dried may have a lower quality, as the starch content may not be fully developed, leading to lower yields and poorer quality grain."
what is Intensive farming.,"is cultivation to maximise productivity, with a low fallow ratio and a high use of inputs (water, fertilizer, pesticide and automation)"
how can the nutritional value of maize flour obtained after starch extraction be increased.,"it can be fortified with vitamins and minerals such as iron, folic acid, and vitamin A"
how many days does the eggs takes to hatch into larvae., two to five days
how are mosquitoes controlled biologically.,"by putting Bt Bacillus thuringiensis ssp. israelensis, a bacterium that infects and kills mosquito larvae, in local water sources."
what is Thiram,"Thiram is a fungicide that is used to control a variety of seed-borne and soil-borne fungal diseases, such as damping-off, seed rot, and seedling bligh"
why should farmers implement disease prevention strategies., to prevent the spread of disease among their livestock
what is the required humidity for cassava growth.,ranging from 70% to 90%
How is cassava planted using single stem method.," In this method, cassava stems are planted directly into the soil at a spacing of 1-1.5 meters between rows and 0.75-1 meter between plants"
why are Gregaria caterpillars considered very deleterious pests.,capable of destroying entire crops in a matter of weeks
what is the approximate Global agricultural production,32 million tonnes of natural fibres
which crop is known to thrive  well in slightly acidic soils with pH levels between 6.0 and 6.5.,Soybeans
why do farmers need to manage the timing and frequency of feedings., to ensure that animals receive adequate nutrition without overeating.
"When is the best time to harvest beans, and how is this determined?",when the pods turn yellow and dry up
name one crop planted by using a seed drill.,corn
How do I know when my corn is ready to harvest?,"Corn is typically ready to harvest when the kernels are firm and have reached their full size, and the ears have a mature appearance"
how do you define Saturation in agriculture.,"This refers to the point at which the soil is completely filled with water, and all air spaces have been displaced. This can occur after a heavy rain or during periods of flooding."
name any example of cover crops that can be grown together with cassava.,mucuna or velvet beans
which nutrient is essential for the production of chlorophyll.,Nitrogen 
which countries import  maize from Uganda.,"Kenya, Rwanda and Burundi."
how does dormancy affects seed germination., allows the seed to delay germination until conditions are more favorable for seedling growth and survival.
can clean planting materials be used to control root rot?,Cassava cuttings should be obtained from healthy plants that have been certified as free from root rot.
what factors should be considered when a applying NPK fertilizers on maize plants.,"soil fertility, crop growth stage, and local recommendations"
why are farmers advisable to leave bean stalk in the garden.,". Bean stalks are rich in nutrients and organic material, which can contribute to improving soil fertility and structure. When the bean stalks decompose, they release nutrients back into the soil, making them available for the next crop."
how long does the adult live.,up to 14 days.
Which soil is better for maize production?,"Maize requires well-drained soils with a good supply of nutrients and moisture. It cannot withstand even a slight degree of waterlogging and therefore can be killed if stands in water for a day. Preferred soil for maize production should also be deep, well-aerated with moderate pH 5.5-6.5, and rich in organic matter."
how does dormancy affects seed germination., allows the seed to delay germination until conditions are more favorable for seedling growth and survival.
Which agricultural method can be used to improve on soil fertility,incorporating cover crops that add organic matter to the soil
What are the roles of mineral matter/particles in the soil,"The mineral particles are primary determinants of soil structure. The smaller the particle, the greater the surface area per unit volume. Bonding and aggregation is much more significant with the availability of large surface areas. Clay sized materials (when moist) impart a ""plastic"" feel to kneaded soil samples"
How long does cassava takes to mature.," It takes between 8 to 18 months to mature, depending on the variety"
 can delaying weeding cassava cause cassava mosaic,"Delaying weeding in cassava fields can create favorable conditions for the spread of Cassava Mosaic Disease (CMD). Weeds can act as alternative hosts for the whiteflies that transmit the virus responsible for CMD. When weeds are left to grow and multiply in the cassava field, they can attract whiteflies and serve as a reservoir for the virus. These whiteflies can then spread the virus to the cassava plants, leading to infection and the development of mosaic symptoms."
How does farming and ranching impact wildlife habitat?," Farmers and ranchers value wildlife conservation and are working hard to improve habitat, while providing food, fiber and fuel to a growing population."
name the types of irrigation.,"flood, furrow, drip, and sprinkler irrigation"
what is the estimates of the annual work-related death toll among agricultural employees.,"at least 170,000"
which variety of maize that is widely grown and used for both human and animal consumption.,Dent maize
which plants prefer acidic soils with a pH range between 4.5 and 6.0.,Rhododendrons and Azaleas
what are organic fertilizers.,"Organic fertilizers are made from natural materials such as compost, manure, and bone meal. They can provide a range of nutrients and help to improve soil structure and fertility over time."
What are the measures farmers can take minimize crop losses during storage," Harvesting crops at the right time and in the right way is important to ensure that they are not damaged during the process. The crops should be harvested when they are mature but not overripe, and the tools used should be in good condition to prevent damage to the crops."
which other regions in Uganda grow apples?,"Bugisu, Bukedi and
Sebei sub regions in areas around Mt. Elgon"
which other can i control the buying of fake agrochemicals.,"Always check the product labels carefully to ensure that the agrochemical is registered by the relevant authorities and has the correct dosage and usage instructions. Fake products often have misspelled words, unclear labels, or no label at all."
why DK maize variety widely grown in Uganda. ,"It is known for its high yield potential, good disease resistance, and adaptability to various growing conditions"
how can we prevent shriveling and rotting of bean seeds.,"To prevent shriveling and rotting of bean seeds, it is essential to implement proper seed handling and storage practices. This includes using high-quality seeds, ensuring seeds are adequately dried before storage, providing appropriate storage conditions (low humidity, good ventilation), and implementing seed treatments or fungicide applications when necessary. Additionally, practicing crop rotation, maintaining good field hygiene, and avoiding excessive irrigation can help reduce the incidence of seedborne diseases."
what is top-dressing?,op-dressing involves applying fertilizer on the soil surface around the base of the bean plants after the first weeding. This method allows the fertilizer to be directly available to the plants' roots and can improve nutrient uptake and yield.
why is compost manure important.,"Compost enhances soil fertility, promotes microbial activity, and improves soil structure and nutrient retention."
what is the required humidity for cassava growth.,ranging from 70% to 90%
name one way bacterial blight can be spread.,"Contaminated planting material: The bacterium can be present in infected cassava stems, which can spread the disease to healthy plants when used as planting material."
what is the recommended time for boiling maize in order to retain vitamin especially vitamin C and D., for no more than 30 minutes
Is agriculture a necessary industry?,Agriculture is a necessity!
can high temperatures cause drought?,"High temperatures can lead to increased evapotranspiration rates, which can lead to soil moisture deficit and reduced water availability for plants."
