question,answers
how do ranchers administer antibiotics?,according to the instructions on the label and under the direction of a veterinarian
What are some common pests that can affect maize crops?,"corn borers, armyworms, and rootworms"
what is depth of the soil for planting maize.,"make an estimate of about 5-7 cm deep, and you can make the holes deeper for dry planting and sandy soil."
Can beans be milled like soyabean for human consumption,"Yes, beans can be milled like soybeans for human consumption. The process of milling involves grinding the beans into a fine powder, which can then be used as a flour in various recipes."
What are Community seed banks,Community seed banks are local repositories of seeds and cuttings that are adapted to the local environment. These seed banks are often managed by farmers themselves and can be a good source of quality seeds and cuttings.
what is crop protection?," Crop protection refers to the various methods used to protect crops from pests, diseases, and other threats"
which type of farmers perform manual weeding.,small-scale cassava farms
Which chemical is best for preserving beans seeds for long periods against weevils,"The chemical most commonly used for preserving beans seeds against weevils is called diatomaceous earth. It is a natural, non-toxic substance made from the fossilized remains of diatoms, which are a type of algae. When diatomaceous earth is applied to bean seeds, it dehydrates and kills the weevils by drying out their outer layer."
can high temperatures cause drought?,"High temperatures can lead to increased evapotranspiration rates, which can lead to soil moisture deficit and reduced water availability for plants."
what is GMO in full?,Genetically Modified Crops
what are Synthetic fertilizers?,are typically made from chemicals and minerals and are designed to provide plants with specific nutrients
Where can we get fertilizer on low price for maize?,"Agricultural input suppliers: Visit local agricultural input suppliers or agro-dealers in your area. They often offer a range of fertilizers, including both synthetic and organic options, at competitive prices. Inquire about any discounts or promotions they may have.

Farmer cooperatives: Joining a farmer cooperative or collective can provide access to bulk purchasing and discounted prices on agricultural inputs, including fertilizers. Cooperative members often benefit from collective bargaining power and can negotiate better prices with suppliers.

Government subsidies or programs: In some countries, governments may offer subsidies or support programs for agricultural inputs, including fertilizers. Check with local agricultural extension services or government agricultural agencies to see if there are any such programs available in your area.

Local composting or organic waste initiatives: If you are interested in organic fertilizers, consider exploring local composting initiatives or organic waste management programs. These initiatives may offer compost or organic fertilizers at lower prices or even for free, as they aim to promote sustainable waste management practices."
Is sandy soil better than clay soil  when growing beans?, neither soil type is inherently better or worse for growing beans
what percentage o electricity does fossil fuel accounts for?, 81% of electricity
what is crop age?,"The time from planting to the date of assessment, inspection or any other key activity."
what is Hybridization.,This involves crossing two different varieties of maize with desirable traits to create a new variety that combines the best traits of both parents.
which fish are grown in farms?,"salmon, catfish, rainbow trout, tilapia, and cod are grown in fish farms"
how is mulching important in agriculture.,"Mulching helps conserve soil moisture, regulate soil temperature, and suppress weed growth."
What are Community seed banks,Community seed banks are local repositories of seeds and cuttings that are adapted to the local environment. These seed banks are often managed by farmers themselves and can be a good source of quality seeds and cuttings.
"Apart from supergro, what other fertilizer can a farmer use to retain moisture in the garden during the period of drought?","Organic matter: Adding organic matter to the soil can help improve soil structure, increase water-holding capacity, and promote healthy root growth. Organic matter can come from compost, manure, or other plant residues."
"when intercropping, what good management practices should be followed.","planting at the right time, spacing the crops correctly, and providing adequate nutrients and water."
can the quality of maize harvest early before its dried be reduced?,"Maize that is harvested before it is fully dried may have a lower quality, as the starch content may not be fully developed, leading to lower yields and poorer quality grain."
How best can picks bags store maize grains for a long period of time?,"PICS (Purdue Improved Crop Storage) bags are specially designed storage bags that can help farmers store maize grains for a long period of time, up to 2-3 years, without using any chemicals"
what other reasons makes cassava a staple food crop.,"Cassava is a hardy crop that can tolerate drought and poor soil conditions. This makes it an important crop for smallholder farmers who may have limited access to water and resources.
"
can the use of farmyard manure increased infiltration?," FYM improves soil permeability and enhances water infiltration into the soil. The organic matter in FYM improves soil structure, creating larger pore spaces that allow water to penetrate more easily into the soil rather than running off the surface."
what is the botanical name for Cassava green mite.,Mononychellus tanajoa
why is seed priming done.,to enhance germination and early seedling growth.
what are some of the tips on how to best use PICS bags for storing maize grains.,"Clean and dry the grains: Before storing maize grains in PICS bags, make sure that they are thoroughly cleaned and dried to a moisture content of around 12-13%. This will help prevent mold and insect growth.

Fill the bags completely: Fill the PICS bags completely with the maize grains, leaving no empty space. This will help prevent the buildup of oxygen and moisture, which can lead to spoilage and insect growth.

Seal the bags tightly: After filling the bags with maize grains, seal them tightly using the PICS bag sealer or a heat sealer. Make sure that there are no holes or leaks in the bags, as this can allow air and moisture to enter.

Store the bags in a cool and dry place: Store the PICS bags in a cool and dry place, away from direct sunlight and sources of moisture. A well-ventilated room or a grain storage facility is ideal for storing PICS bags.

Check the bags regularly: Check the PICS bags regularly for any signs of damage, such as holes or leaks, and for any signs of insect or mold growth. If any damage or signs of infestation are found, take immediate action to prevent further damage."
"which pest feed on the sap of the bean plant, causing stunting and distortion of the leaves",Bean aphids (Aphis fabae)
name two types fertilizers.,organic and inorganic fertilizers
May we farmers know the uses of water in the soil,"Water is necessary for plants to absorb nutrients from the soil. Water dissolves nutrients and makes them available to plant roots, which can then take up the nutrients they need for growth."
which body oversees organic certification>,USDA National Organic Program (NOP)
What are some sustainable farming practices that can help reduce environmental impact?,Sustainable farming practices can help
which maize variety is resistant to crop pest and diseases.,"CIMMYT (International Maize and Wheat Improvement Center) hybrids: CIMMYT develops and releases several maize hybrids that have shown resistance to pests and diseases in various regions.

DKC (Dekalb) hybrids: Dekalb is a well-known seed company that offers a range of maize hybrids with resistance to specific pests and diseases.

Pannar hybrids: Pannar is another seed company that offers maize hybrids with resistance to various pests and diseases."
what do i look when inspect the packaging.," Look for signs of tampering, such as broken seals or mismatched packaging, which may indicate that the product is fake."
what type of fertilizers are made from chemical?,synthetic fertilizers
how does seed drying prevent spoilage.," Drying seeds effectively reduces the risk of spoilage during storage. Moisture provides a favorable environment for the growth of microorganisms, such as fungi and bacteria, which can attack and damage seeds. By reducing moisture content through drying, farmers can inhibit the growth of these organisms and minimize the risk of seed spoilage and loss."
What are the roles of mineral matter/particles in the soil,"The mineral particles are primary determinants of soil structure. The smaller the particle, the greater the surface area per unit volume. Bonding and aggregation is much more significant with the availability of large surface areas. Clay sized materials (when moist) impart a ""plastic"" feel to kneaded soil samples"
which region is commonly infested by CBSD.,"East and Central Africa,"
is TMS 30572 cassava variety popular in nigeria?,2177
does harvesting maize early before its dried causes mycotoxin contamination?,"Maize that is harvested before it is fully dried is at a higher risk of mycotoxin contamination, which can pose health risks to both humans and animals if consumed."
which organic fertilizer is good for cassava cultivation.,compost or animal manure
what is the long term control measures for the cassava diseases.,using disease-resistant cassava varieties
which crop is known to thrive  well in slightly acidic soils with pH levels between 6.0 and 6.5.,Soybeans
which nutrient is essential for the production of chlorophyll.,Nitrogen 
Which fertilizer is good for planting beans?,farmyard manure (FYM) and compost manure
what is the importance of agriculture.," It creates jobs, helps our economy and provides our basic necessities"
which beneficial microorganisms are contained in microbial fertilizers.,bacteria and fungi
what are organic fertilizers?," are derived from natural sources such as animal manure, compost, and plant residues"
name districts in the West Nile Region that are susceptible to drought.,"Adjumani, Arua, Koboko, Maracha, Moyo, Nebbi, Pakwach, and Yumbe"
how does nitrogen-fixing bacteria helps improve soil fertility.,"help to improve soil fertility by converting atmospheric nitrogen into a form that plants can use.
"
which plant nutrient helps in formation of chlorophyll . , magnesium (Mg)
In what ways can farmers manage maize streak disease.,"Planting resistant or tolerant maize varieties that have been developed through breeding programs.
Practicing good weed control, as certain weed species can serve as alternative hosts for the virus and leafhoppers.
Implementing integrated pest management strategies to control leafhopper populations, such as using insecticides or employing physical barriers.
Proper crop rotation and maintaining good agronomic practices to enhance plant health and reduce disease pressure.
Removing and destroying infected plants and plant debris to reduce the source of the virus.
It is essential for farmers to work closely with agricultural extension services and research institutions to access information on resistant varieties, disease management strategies, and early warning systems for maize streak disease in their specific region."
How can local maize breeds be improved  on productivity?,"Selective breeding: This involves selecting the best plants in terms of yield, disease resistance, and other desirable traits and using them as parents to produce offspring with improved traits."
what is the ridges or furrows dimensions to be created.,30 cm high and 60 cm wide
what kind of information is collected by tools used in precision agriculture?," soil moisture, nutrient levels, and other factors"
"White flies have become resistant to pesticides, what else can farmers do eradicate them?","Integrated pest management (IPM): IPM is a holistic approach to pest management that involves a combination of techniques to control pests, including cultural, biological, and chemical methods. IPM can help to reduce the reliance on pesticides and prevent the development of pesticide resistance."
Does most of the money I pay for food go back to the farmer?,Not necessarily
how can you tell a cassava plant is mature.,"The leaves of mature cassava plants begin to yellow and fall off, and the lower stems of the plant become woody."
why do cassava propagated through stem cuttings matures faster compared to seed propagation.,This is because the stem cuttings already have a head start in development and can quickly establish roots and start growing.
how can you break chemical dormancy.,by leaching the seed in water or by exposing it to a specific temperature or light regime.
"which variety is grown in Colombia and is known for its high yield potential, disease resistance, and good processing qualities.",COCU 001
What is the appropriate distance for planting beans,"The appropriate distance for planting beans can vary depending on several factors such as the bean variety, soil fertility, and available resources. However, as a general guideline, bush beans are typically planted with a spacing of 6-8 inches (15-20 cm) between plants and 18-24 inches (45-60 cm) between rows. This spacing allows the plants to have enough room for proper growth, airflow, and access to sunlight. For pole beans, which require support, you can plant them in rows spaced about 3 feet (90 cm) apart, with the plants spaced 6-8 inches (15-20 cm) apart within the rows."
How can clay soil be improved?,"Both sandy and clay soils have unique characteristics that can make it challenging to sustain a variety of crops. However, there are several ways in which the properties of these soil types can be improved to make them more fertile and productive for crop growth. Add organic matter, user cover crops,crop rotation, use of soil amendments."
why do farmers need to consider intercropping beans with cassava.," beans can provide shade for young cassava plants, which can help to reduce water stress during the early stages of growth."
Suggest the advantages of clay soil,"Poor drainage: Clay soils have small pore spaces, which can lead to slow drainage and waterlogging in areas with heavy rainfall. This can reduce soil aeration and lead to root rot in some crops.
Heavy and difficult to work: Clay soils are heavy and can be difficult to till and cultivate with farming equipment.
Slow to warm up: Clay soils can be slow to warm up in the spring, which can delay planting and crop growth.
Prone to compaction: Clay soils are prone to compaction, which can reduce soil aeration and root growth."
what is crop rotation.,This involves rotating cassava with other crops such as maize or soybean to help control weeds
which fungal disease affects cassava,Root rot
can the use of farmyard manure increased infiltration?," FYM improves soil permeability and enhances water infiltration into the soil. The organic matter in FYM improves soil structure, creating larger pore spaces that allow water to penetrate more easily into the soil rather than running off the surface."
How does FAO defines agricultural automation.,"FAO defines agricultural automation as the use of machinery and equipment in agricultural operations to improve their diagnosis, decision-making or performing, reducing the drudgery of agricultural work and/or improving the timeliness, and potentially the precision, of agricultural operations."
what does S. exempta larvae feeds on?,Poaceae
what is the best time to plant maize,You need to plant your maize at the onset of the rains either in March or in August to Septembe
how can you minimize the effects of anti-nutrients in beans.,"it is recommended to soak, sprout, or ferment the beans before milling them. These processes can help to break down the anti-nutrients and make the nutrients more bioavailable."
how can farmers improve soil fertility of a clay soil.,"Improve drainage: Incorporate organic matter, such as compost or well-rotted manure, into the soil to improve its structure and drainage capacity.

Amend the soil: Add sand or other coarse materials to clay soil to improve its texture and increase its drainage ability.

Implement proper tillage practices: Avoid over-tilling or working the soil when it is too wet, as this can lead to compaction. Use appropriate tillage techniques to break up compacted soil layers and improve root penetration.

Apply organic matter: Regularly add organic matter, such as compost or cover crops, to the soil to enhance its fertility, structure, and water-holding capacity.

Practice crop rotation: Rotate maize with other crops that have different root structures and nutrient requirements to help break up compacted soil and reduce the risk of soil-borne diseases."
which two countries contribute to 80 percentage of the sea food, Asia and Latin America
how can soil living organism helps control pest and diseases.," Some soil organisms, such as certain species of bacteria and fungi, can help to control pests and diseases by competing with or attacking harmful organisms."
what causes hunger?,poverty
which diseases can be spread by whiteflies?,"The whiteflies can spread viruses such as CMD and CBSD, which can cause significant losses for farmers."
what is Food Supply Continuum,The process of getting food from the farm to the table
explain how over grazing destroy soil nutrients.,"Overgrazing by livestock can lead to soil compaction, erosion, and loss of soil organic matter, which are all detrimental to soil fertility."
What is the best chemical for the treatment of bean seeds?,"Thiram: This is a fungicide that is used to protect bean seeds against various soil-borne diseases, including Fusarium and Rhizoctonia"
What is total seed population in an acre?,"For soybeans, the recommended plant population is typically higher, ranging from 100,000 to 200,000 plants per acre. This corresponds to seeding rates of approximately 125,000 to 250,000 seeds per acre."
Which two types of beans gives high yields...the climbing beans or the ordinary beans?,Both climbing beans and bush (ordinary) beans can give high yields if they are properly managed and grown under suitable conditions. 
which tools can farmers use to monitor water patterns in order to guard against drought.,"hey can use tools such as soil moisture sensors, weather stations, and remote sensing to gather information on conditions in their fields."
What are the measures farmers can take minimize crop losses during storage," Harvesting crops at the right time and in the right way is important to ensure that they are not damaged during the process. The crops should be harvested when they are mature but not overripe, and the tools used should be in good condition to prevent damage to the crops."
What causes cassava seedling blight?,Xanthomonas axonopodis pv. manihotis is the pathogen that causes bacterial blight of cassava
which population is vulnerable  in agriculture.,Ages 0�6
how are pesticides applied to crops.,"by agricultural aircraft, tractor-mounted crop sprayers, aerial spray by modern aircraft or as seed dressings to control pests."
give examples of vegetables that be intercropped wit maize.,"pumpkin, squash, or sweet potato"
which fruit crops can cassava be intercropped with?,"mango, citrus, and avocado"
what the advantages of natural food?,make cows produce more milk and chickens produce more eggs
At what spacing can cassava be intercropped with beans?,"Cassava and beans can be intercropped at a spacing of 75 cm between cassava rows and 50 cm between bean rows, with a spacing of 25-30 cm between bean plants within the rows"
How does FAO defines agricultural automation.,"FAO defines agricultural automation as the use of machinery and equipment in agricultural operations to improve their diagnosis, decision-making or performing, reducing the drudgery of agricultural work and/or improving the timeliness, and potentially the precision, of agricultural operations."
how can farmers mitigate leaf shedding in cassava during the dry season,"Irrigation: Providing supplemental irrigation to cassava plants during dry periods can help alleviate water stress and maintain adequate soil moisture levels.

Mulching: Applying organic mulch around the cassava plants can help conserve soil moisture, regulate soil temperature, and reduce water evaporation from the soil surface.

Fertilization: Ensuring optimal nutrient levels through balanced fertilization can help maintain the health and vigor of cassava plants, reducing the risk of nutrient deficiencies and associated leaf shedding.

Pest and disease management: Implementing appropriate pest and disease control measures, such as regular scouting and timely application of recommended treatments, can help minimize leaf damage and subsequent leaf shedding."
May we farmers know the uses of water in the soil,"Water is necessary for plants to absorb nutrients from the soil. Water dissolves nutrients and makes them available to plant roots, which can then take up the nutrients they need for growth."
What is necessary to facilitate seedling growth during the germination process?,to ensure adequate moisture levels during the germination process
what cultural methods are involved when eradicating whiteflies.,"Cultural control methods involve practices such as crop rotation, sanitation, and the use of reflective mulches, which can help to reduce whitefly populations by creating unfavorable conditions for their growth and reproduction."
What are the problems facing farming organization in uganda?,"Limited access to finance: Many farming organizations in Uganda lack access to finance, which makes it difficult for them to invest in modern farming technologies, hire skilled workers, and expand their operations.

Limited access to markets: Many small-scale farmers in Uganda struggle to access markets to sell their products, which can result in low prices and limited income.

Climate change: Uganda is vulnerable to climate change, which can have a negative impact on crop yields and overall agricultural productivity.

Pest and disease outbreaks: Uganda has experienced several pest and disease outbreaks in recent years, such as the Fall Armyworm and Banana Bacterial Wilt, which can significantly reduce crop yields and income.

Limited access to extension services: Many farmers in Uganda lack access to extension services and technical assistance, which can limit their ability to adopt modern farming technologies and improve their farming practices.

Land tenure insecurity: Land tenure insecurity is a common challenge in Uganda, particularly for small-scale farmers, which can limit their ability to invest in their farms and access credit.

Poor infrastructure: Poor infrastructure, including inadequate roads, storage facilities, and irrigation systems, can limit the ability of farming organizations in Uganda to transport their products, store them properly, and irrigate their crops during dry spells."
Give one example of  natural erosion caused by water.,Grand Canyon
What is threshing?,separate the beans from the pods and other debris
