question,answers
What are the symptoms of Tip over or Heart rot in banana plants?,"Symptoms of Tip over or Heart rot in banana plants include rotting at the base of the pseudostem and upper portion of the corm. Young plantations, especially those aged 1-3 months, are particularly susceptible to this disease, especially during summer months."
What are some common banana varieties cultivated for commercial production?,"Common banana varieties include Cavendish (e.g., Grand Naine, Dwarf Cavendish), Gros Michel, Lady Finger (also known as Pisang Raja or Musa acuminata), and Plantain (e.g., French, Horn, and Giant Horn)."
"What are common pests and diseases affecting grapevines, and how can I control them?","Common grape pests include grapevine phylloxera, grape berry moth, and powdery mildew. Integrated pest management (IPM) practices involving cultural, biological, and chemical control methods are used to manage them."
Do guava trees require cross-pollination for fruit set?,"Most guava varieties are self-pollinating, meaning they can produce fruit without requiring pollen from another tree. However, cross-pollination by insects can increase fruit set and yield. Introducing pollinator-attracting plants nearby can enhance pollination and fruit production."
"What's the name of the disease affecting Apple trees, characterized by powdery white patches on various parts?","Powdery mildew, caused by Podosphaera leucotricha, is the disease affecting Apple trees, characterized by powdery white patches on buds, blossoms, leaves, twigs, and fruit."
What are the symptoms of common scab in potato tubers?,"Symptoms include corkiness of the tuber periderm, russette appearance 1/4 inch into the tuber surface, slight pitting on the infected tuber, and the appearance of light brown to dark brown lesions. Affected tissue may attract insects."
What is the pathogen responsible for Gray Mould?,"The pathogen is Botrytis cinerea. The mycelium is septate and branched, initially hyaline but becoming dark in color with age. Conidiophores are branched and bear conidia at the apex. Conidia are oblong and dark, either continuous or with one septum."
How does Anthracnose spread within mango orchards?,"Anthracnose spreads within mango orchards through various means. The pathogen survives on dried leaves, defoliated branches, mummified flowers, and flower brackets. Secondary spread occurs through contact with diseased fruit during transport and storage, as well as through airborne conidia."
What are the signs of Sooty mould on mango trees?,"Sooty mould in mango trees manifests as dark, superficial mycelium on the leaf surface, resulting in the formation of black encrustations. This growth is fueled by sugary secretions from plant hoppers such as jassids, aphids, and scale insects."
What is the pathogen responsible for Sigatoka disease in bananas?,"The pathogen is Mycosphaerella musicola (Cercospora musae). Conidia are elongated, narrow, and multi-septate, measuring 20-80 x 2-6 microns. Perithecia are dark brown to black."
What is the pathogen causing Bird’s Eye Spot/Anthracnose in grapes?,"The pathogen is Gloeosporium ampelophagum (Elsinoe amphelina). Its mycelium is septate and dark-colored. Conidia are single-celled, oval, and hyaline."
"How can I market guavas effectively, especially in areas with high competition?","Effective marketing strategies for guavas include highlighting their nutritional benefits, unique flavor, and versatility in culinary applications. Establishing direct relationships with local markets, retailers, and consumers can also help differentiate your guava products and attract customers."
What are the symptoms of post-harvest tuber rots caused by Sclerotium rolfsii in potato plants?,"The initial symptom is wilting, followed by the appearance of yellowish-brown colored sclerotia on the infected tuber. The tuber rots and develops a milky white and floccose appearance."
How does soft rot spread and survive in potato plants?,"Soft rot spreads through infected tubers attracting flies like Hymelia and Phorlin sp., and through immature contaminated soil and tubers. The optimum temperature for its spread is 21 to 29°C with a relative humidity of 94%."
What are the symptoms of Pythium root rot?,"Pythium root rot causes seed rotting, pre-emergence damping off, circular patches in the field, and plant death. It can also lead to gappiness in the crop if it occurs before seed germination and stunting of the plant with root rot if it occurs late."
What's the organism responsible for Anthracnose in mango trees?,"Anthracnose in mango trees is caused by the pathogen Colletotrichum gloeosporioides. This organism produces septate and colored mycelium. The conidia produced are single-celled, hyaline, small, and elongated."
What are the indicators of grape ripeness for different grape varieties?,"Ripeness indicators include changes in berry color, sugar content (measured as Brix), acidity levels, and flavor development. Different grape varieties exhibit specific ripening characteristics, and harvest decisions are often based on a combination of these factors."
What are the symptoms of Basal Rot?,"Symptoms include yellowing and slow drying of leaves, drying of leaf tip downwards, complete drying of foliage, soft rotting of bulbs with rotted roots, and whitish mouldy growth on the scale. The disease can begin in the field and continue in storage."
How can Sigatoka disease in bananas be managed?,Removal and destruction of affected leaves. Spray Propiconazole + Carbendazim 0.1% or Chlorothalonil 0.25%. Add wetting agent such as teepol or sandovit at a rate of 1ml/lit of water.
How does Grey Blight spread within mango orchards?,Grey Blight spreads within mango orchards by surviving on mango leaves for over a year and spreading through wind-borne conidia. Heavy infection is noticed during the monsoon when the temperature is 20-25˚C and humidity is high.
What kind of fertilizer should I use for mango trees?,A balanced fertilizer with a ratio like 6-6-6 or 8-3-9 (N-P-K) supplemented with micronutrients like zinc and magnesium is suitable for mango trees. Apply in split doses.
How can Anthracnose in guava trees be managed?,Effective management of Anthracnose in guava trees involves spraying with fungicides such as Mancozeb at a concentration of 0.25%. It's also important to implement cultural practices such as proper sanitation and pruning to reduce the spread of the disease.
"How much water do sapota trees need, and how often should I irrigate?","Sapota trees require regular watering, especially during the dry season and fruit development stage. Young trees need more frequent irrigation, while mature trees can tolerate drought conditions. Irrigation frequency and amount depend on soil moisture levels and weather conditions."
"How much water do apple trees need, and how often should I irrigate?","Apple trees require regular watering, especially during dry periods and fruit development stages. Deep, infrequent watering is preferred to encourage deep root growth and prevent water stress. Irrigation frequency and amount depend on soil moisture levels, weather conditions, and tree age."
What are the favorable conditions for the development of late blight in potato plants?,"Favorable conditions for late blight development include RH > 90%, temperature between 10-25°C, night temperature of 10°C, cloudiness followed by rainfall of at least 0.1mm the following day."
How does the Botrytis leaf blight pathogen spread beyond the initial infections?,"Secondary cycles of infection occur in cull piles and seed fields, with conidia being blown to commercial bulb production fields. Infected leaves serve as secondary sources of inoculum, with repeated infections occurring throughout the growing season."
How can Red-rust in mango trees be managed?,Effective management of Red-rust in mango trees involves using Bordeaux mixture (0.6%) or Copper oxychloride (0.25%) to control the disease. These treatments help reduce the spread of the disease and prevent its impact on mango foliage.
"How much water do guava trees need, and how often should I irrigate?","Guava trees require regular watering, especially during the dry season and fruit development stage. Young trees need more frequent irrigation, while mature trees can tolerate drought conditions. Irrigation frequency and amount depend on soil moisture levels and weather conditions."
What are the symptoms of Sooty mould on Sapota leaves?,"Sooty mould on Sapota leaves is characterized by a fungal growth that slowly covers the entire leaf area, severely affecting the process of photosynthesis. This results in reduced translocation of food to the fruits, leading to a reduction in their size."
What management strategies can be used to control Fusarium wilt in tomato plants?,Affected plants should be removed and destroyed. Spot drenching with Carbendazim (0.1%) is recommended. Crop rotation with a non-host crop such as cereals can also help manage Fusarium wilt.
How does white rot spread and persist in onion and garlic crops?,"White rot is worst in warm summers or during warm spells in autumn or spring. Sclerotia, which persist in the soil for up to eight years, are the primary inoculum. Flood water transports sclerotia from field to field."
What are some common citrus varieties grown commercially?,"Common citrus varieties grown commercially include oranges (e.g., Valencia, Navel), grapefruits (e.g., Ruby Red), lemons (e.g., Eureka, Lisbon), and limes (e.g., Tahiti)."
What are some general tips for maintaining healthy guava trees?,"Some general tips for maintaining healthy guava trees include regular pruning to remove diseased or dead branches, providing adequate spacing between trees for good air circulation, avoiding overhead irrigation to reduce humidity, and monitoring for pests and diseases regularly."
How should I prune guava trees for optimal growth and fruit production?,"Pruning guava trees involves removing dead or diseased branches, shaping the canopy to improve airflow and sunlight penetration, and thinning out excess growth to promote fruit development. Pruning is usually done after harvesting or during the dormant season."
How should I prune sapota trees for optimal growth and fruiting?,"Pruning sapota trees involves removing dead or diseased branches, shaping the canopy to improve airflow and sunlight penetration, and thinning out excess growth to promote fruit development. Pruning is usually done after harvesting or during the dormant season."
What is the pathogen responsible for Tomato Spotted Wilt Disease (TSWV)?,"The pathogen is Tomato Spotted Wilt Virus (TSWV), which consists of isometric particles approximately 70 to 90nm in diameter. The thermal inactivation point of the virus is 40˚C."
What are some organic methods for controlling diseases and pests in citrus orchards?,"Organic methods for controlling diseases and pests in citrus orchards include using beneficial insects, applying neem oil or insecticidal soap, practicing crop rotation, and maintaining soil health through organic amendments."
"When is the best time to harvest bananas, and how do I know if they're ready?","Bananas are typically harvested when they reach physiological maturity, indicated by changes in skin color, size, and firmness. Mature bananas also develop a distinct aroma and detach easily from the bunch."
What's the fungal disease affecting Sapota leaves due to honeydew-like excretion?,"Sooty mould, caused by Capnodium sp., is the fungal disease affecting Sapota leaves due to honeydew-like excretion secreted by aphids and scale insects."
What are the symptoms of Phoma Rot?,"Symptoms are distinguished by the black color of the spots, which are small, black, pimple-like eruptions. These specks are the pycnidia or fruiting bodies of the fungus. The disease occurs under moderate temperature and high humidity conditions."
What management strategies are effective against Leaf Blight (Blast)?,"Bulb treatment with Captan or Thiram 0.25% and spraying of Maneb, Mancozeb, or Chlorothalonil are effective. Fungicides may be applied every 5-7 days for disease control."
"What diseases are citrus trees susceptible to, and how can I prevent them?","Citrus trees are vulnerable to diseases such as citrus greening (HLB), citrus canker, and citrus black spot. Preventative measures include regular inspection, proper sanitation, and disease-resistant varieties."
What pathogens are associated with Anthracnose in bananas?,"Anthracnose in bananas is caused by Gloeosporium gloeosporioides. Acervuli produce cylindrical conidiophores and hyaline, non-septate, oval to elliptical conidia."
What is the economic importance of Banana Bunchy Top virus?,"Banana Bunchy Top virus is covered by domestic quarantine regulations due to significant economic losses. Losses were estimated to be Rs. 4 crores every year, and planting infected suckers results in 100% loss."
How should I fertilize banana plants for optimal growth?,"Banana plants benefit from balanced fertilization with a high potassium (K) content, such as 6-2-12 NPK fertilizer, supplemented with organic matter. Apply fertilizers in split doses throughout the year."
"What's the name of the disease affecting Apple trees, characterized by water-soaked leaves and blackened twigs?","Fire blight, caused by Erwinia amylovora, is the disease affecting Apple trees, characterized by water-soaked leaves, blackened twigs, and wilting of terminal branches."
What is the pathogen responsible for Tomato Mosaic Virus (TMV) in tomato plants?,"The pathogen is Tomato mosaic virus (TMV), which is a rod-shaped, non-enveloped virus particle. Its thermal inactivation point is 85 - 90˚C."
What is the pathogen responsible for causing Exocortis of scaly butt in citrus trees?,"Exocortis of scaly butt in citrus trees is caused by Viroid, a pathogen that is a free RTVA (Ribonucleic Acid Virusoid) without a protein coat."
How does Greening spread within citrus orchards?,Greening spreads within citrus orchards primarily through the transmission of infected budwood and by the psyllid vector Diaphorina citri. Infected budwood and the feeding activities of psyllids contribute to the spread of the disease among citrus trees.
"When is the best time to prune citrus trees, and what are the objectives of pruning?","The best time to prune citrus trees is typically in late winter or early spring before new growth starts. Objectives of pruning include shaping the tree, removing dead or diseased branches, and improving air circulation."
What are some common grape varieties grown for commercial production?,"Common grape varieties for commercial production include Cabernet Sauvignon, Chardonnay, Merlot, Pinot Noir, Sauvignon Blanc, and Syrah, among others. Varieties are chosen based on climate, soil, and market demand."
What's the disease affecting Sapota leaves characterized by small spots?,"Leaf spot, caused by Phaeoleospora indica, is the disease affecting Sapota leaves, characterized by numerous, small, pinkish to reddish-brown spots with whitish centers."
How can Sooty mould on Sapota leaves be managed effectively?,"Sooty mould on Sapota leaves can be managed effectively by spraying a 5% starch solution to remove the fungal growth. Additionally, controlling insects by spraying systemic insecticides can help prevent further infestation."
How can Soft rot in Apple trees be effectively managed?,Effective management of Soft rot in Apple trees involves careful handling of fruits without causing any wounds. Dipping the fruits in aureofungin-sol at 500 ppm for 20 minutes is recommended for the best control of the disease.
"What are mosaic viruses, and what are their symptoms in chilli plants?","Mosaic viruses in chilli plants exhibit symptoms such as light green and dark green patches on the leaves, stunted plant growth during early stages, and yellowing, chlorotic ring spots on leaves and fruits."
How can citrus trees be protected from frost damage?,"Citrus trees can be protected from frost damage by using frost cloth, applying irrigation to create a protective ice barrier, using heaters or smudge pots, and planting in frost-free locations or using microclimate management techniques."
"What are some common pests that infest citrus trees, and how can they be managed?","Common pests infesting citrus trees include citrus psyllids, citrus leaf miners, and citrus root weevils. They can be managed through cultural practices, biological control, and chemical pesticides."
How does Panama disease spread in banana plants?,"Panama disease spreads in banana plants through infected rhizomes and irrigation water. The pathogen survives in the soil as chlamydospores for extended periods, and continuous cultivation results in the buildup of inoculum."
How can Cigar End Rot in bananas be managed?,Removal of pistil and perianth by hand 8-10 days after bunch formation and spraying the bunch with Dithane M -45 (0.1%) or Topsin M (0.1%) effectively controls the disease.
What are the ideal conditions for planting banana suckers?,"Banana suckers should be planted in well-drained, fertile soil with plenty of organic matter. They thrive in tropical climates with temperatures around 27°C to 30°C and require ample sunlight."
What are the characteristics of the pathogen causing soft rot in potato plants?,The pathogen causing soft rot in potato plants is Erwinia carotovora subsp. caratovora. It is a gram-negative rod-shaped bacterium with 1 to 6 peritrichous flagella.
How can Moko disease in banana plants be managed?,"Effective management of Moko disease involves eradicating infected plants, exposing soil to direct sunlight, using clean planting material, practicing fallowing and crop rotation, disinfecting pruning tools, and ensuring good drainage."
What's the major disease affecting bananas known as?,"Panama disease, caused by Fusarium oxysporum f. sp. cubense, is the major disease affecting bananas. It is a soil-borne fungal disease that enters the plant through roots and wounds caused by nematodes."
What are the symptoms of Cigar End Rot in bananas?,"A black necrosis spreads from the perianth into the tip of immature fingers. The rotted portion of the banana finger is dry and tends to adhere to fruits, resembling the ash of a cigar."
What type of soil is best suited for banana cultivation?,"Bananas prefer deep, well-drained, fertile soil with good water retention capacity. Sandy loam or loamy soil types with a pH range of 5.5 to 7.0 are ideal for optimal growth and fruit production."
What are the best practices for post-harvest handling of bananas?,"Post-harvest handling includes careful handling to prevent bruising, washing to remove dirt, and proper storage in a cool, well-ventilated area to extend shelf life. Packaging should also be appropriate to prevent damage during transportation."
"What are the characteristics of Colletotrichum capsici, the pathogen causing fruit rot and die back in chilli plants?",The mycelium is septate and inter and intra-cellular. Conidia in mass appear pinkish and are borne singly at the tip of conidiophores.
How does late blight spread and survive in potato plants?,"Late blight spreads through infected tubers and soil, which serve as a source of primary infection. Airborne infection is caused by sporangia. The disease persists from crop to crop mainly through diseased tubers."
What management strategies can be used to control Early Blight in tomato plants?,"Management strategies include removal and destruction of crop debris and practicing crop rotation to minimize disease incidence. Additionally, spraying the crop with Mancozeb 0.2% can provide effective disease control."
What are effective management strategies against smut in onions and garlic?,Effective management strategies include seed treatment with Thiram or Captan at 4g/kg and dipping bulbs in a Thiram solution at 0.25%. These measures help reduce the spread and impact of the disease.
What are some best practices for post-harvest handling of citrus fruits to maintain quality?,"Best practices for post-harvest handling of citrus fruits include careful harvesting to avoid bruising, prompt cooling to preserve freshness, proper storage in controlled atmospheres, and gentle handling to prevent damage."
"What are common pests that affect citrus trees, and how can I control them?","Common citrus pests include citrus psyllids, aphids, scales, and mites. Integrated pest management (IPM) practices involving cultural, biological, and chemical control methods are used to manage them."
How does powdery mildew spread and survive?,It spreads through air-borne conidia and through dormant mycelium and conidia present in infected shoots and buds. Sultry warm conditions with dull cloudy weather are highly favorable for its spread and survival.
What type of soil is best for growing grapes?,"Grapes thrive in well-drained, moderately fertile soil with a pH level between 6.0 and 7.0. Sandy loam or loamy soils with good drainage are ideal for grape cultivation."
What type of soil is best for mango cultivation?,"Mangoes prefer well-drained, sandy or loamy soil with a pH range of 5.5 to 7.5. Soil should be rich in organic matter. Avoid waterlogged or heavy clay soils."
How should I fertilize banana plants for maximum yield?,"Banana plants require regular fertilization with balanced nutrients, including nitrogen (N), phosphorus (P), and potassium (K), supplemented with micronutrients like magnesium and zinc."
How should I prune grapevines for optimal yield and quality?,"Pruning grapevines involves removing old or excess growth, training the vines onto a trellis system, and thinning out clusters to improve airflow and sun exposure. Pruning is typically done during the dormant season."
How can Bitter rot in Apple trees be effectively managed?,"Effective management of Bitter rot in Apple trees involves spraying Mancozeb at 0.25% in the field. Additionally, treatment with Mancozeb at 0.25% is recommended to check the disease in storage."
What are the characteristics of the pathogen causing Alternaria rot in chilli plants?,"Hyphae are septate, branched, light brown becoming darker with age, and both inter and intracellular. Conidiophores emerge through stomata, and conidia are single and muriform."
What type of soil is best for growing citrus trees?,"Citrus trees thrive in well-drained, slightly acidic soil with a pH range of 6.0 to 7.5. Sandy loam or loamy soil types are ideal, ensuring good aeration and root development."
When is the best time to harvest grapes for wine production?,"Grapes for wine production are typically harvested when they reach optimal sugar levels and flavor maturity, determined by regular sampling and analysis of grape juice. Harvest timing varies by grape variety and wine style."
When is Leaf spot disease most severe in Sapota trees?,Leaf spot disease in Sapota trees is most severe during October to December when humidity is high. The fungus responsible for the disease thrives best at 25°C and 90% relative humidity.
Do sapota trees require cross-pollination for fruit production?,"Most sapota varieties are self-pollinating, but cross-pollination by insects can increase fruit set and yield. However, in most cases, sapota trees can produce fruit without the need for cross-pollination."
What management practices can be implemented to control damping off in chilli plants caused by Pythium aphanidermatum?,Soil drenching with Copper oxychloride at a concentration of 0.25% can be effective in managing damping off in chilli plants.
What are the symptoms of early blight in potato plants?,"Early blight presents as brown-black necrotic spots with angular or oval shapes, characterized by concentric rings. These spots coalesce and spread all over the leaf, and shot holes may appear on fruits."
How does Early Blight spread and survive in tomato plants?,"The pathogen, Alternaria solani, spreads through wind and rain splashes. Under dry conditions, it survives in infected plant debris in the soil for up to three years and can also be seed-borne."
What is the pathogen responsible for Bacterial Leaf Spot in tomato plants?,"The pathogen is Xanthomonas campestris pv. vesicatoria, a gram-negative, short rod-shaped bacterium with a single polar flagellum. Capsules are formed."
What are common pests and diseases that affect banana plants?,"Common banana pests include banana weevils, nematodes, and aphids, while diseases such as Panama disease (Fusarium wilt) and black Sigatoka can significantly impact banana cultivation."
What are the characteristics of the pathogen associated with Freckle or Black Spot in bananas?,"The fungus produces pycnidia and pycnidiospores. Pycnidiospores are needle-shaped, hyaline, and multi-septate."
What spacing should I use when planting banana plants?,"Banana plants are typically spaced around 2 to 3 meters apart in rows, with rows spaced approximately 2 to 3 meters apart as well. Proper spacing ensures adequate airflow and sunlight penetration."
How can I market bananas effectively?,"Effective marketing of bananas involves identifying target markets, ensuring consistent quality, establishing relationships with buyers such as retailers and wholesalers, and exploring value-added options like organic or fair-trade certification."
What are the typical symptoms of Guava rust?,"Typical symptoms of Guava rust include distortion, defoliation, reduced growth, and, if severe, mortality. On fully expanded leaves, you may observe dark-bordered, roughly circular brown lesions with yellow halos."
What is the name of the disease that causes light brown watery rot starting from the stem end of the fruit in Apple trees?,"Soft rot, caused by Penicillium expansum, is the disease that causes light brown watery rot starting from the stem end of the fruit in Apple trees."
