question,answers
What type of maize seed is resistant to pests and diseases?,Bt maize
define what is intercropping., several crops are grown at the same time
What is the effect of Cassava Mosaic Disease (CMD) in severe condition.,yield losses of up to 100%
what are some of the ways of managing armyworms.,"use of insecticides, such as pyrethroids or neem oil, applied directly to the cassava plant or to the soil."
What is threshing?,separate the beans from the pods and other debris
why do farmers prefer TME 419 variety.,It has good yield potential and is resistant to cassava mosaic disease and cassava brown streak disease.
how do we prevent foodborne illness?,"cook foods to proper temperatures, use separate cutting boards for uncooked meat and ready?to?eat foods, store leftover food in shallow containers and refrigerate within two hours."
Which pests affects mostly beans?,Bean weevils
why should farmers ensure proper land preparation before planting cassava.,for ensuring a healthy and high-yielding cassava crop
name one chemical pesticides that can be applied to control termides.,termiticides
Is the primary focus of the USDA agricultural programs?,"7% of the total USDA budget. Rural development, research, food safety, marketing and regulatory, and departmental management accounts for 6% of the budget"
what is the use of living organism in the soil.,"Soil organisms, such as earthworms, termites, and nematodes, play a vital role in improving the soil structure. They help to break down organic matter, loosen compacted soil, and improve soil porosity, allowing air, water, and nutrients to move more freely through the soil."
"In top side dressing, at what stage should fertilizers be applied? ","""vegetative stage"" or ""early growth stage"" of the plant"
"which indicator can be used to check for cassava maturity.
",Time since planting
name the phase in polyphenism in which the larvae raised in isolation turns green,solitaria 
how does nutrient leaching affects cassava yield.,"Wetland soils are prone to nutrient leaching due to excessive water movement. The continuous flow of water can carry away essential nutrients from the soil, making them unavailable to cassava plants. Nutrient deficiencies can negatively impact plant growth, development, and overall productivity."
"which nutrient  is important for root development, flowering, and fruiting.",Phosphorus 
what is strip cropping.,Planting different crops in alternating strips across the slope helps to reduce erosion by breaking up the flow of water. The alternating strips of different crops create barriers that trap sediment and prevent it from being washed away.
How should the soil be prepared before planting beans?, the soil must be prepared by removing weeds and incorporating organic matter such as compost or manure to improve soil fertility.
Where else can we farmers get the beans seeds with iron content?,Check with research institutions: Agricultural research institutions often conduct research on crop varieties with higher iron content. You can check with local research institutions or universities to see if they have developed bean varieties with higher iron content and if those seeds are available for purchase.
Are genetically modified organisms (GMOs) the only organisms with genes?,"No. Living or once living things contain genes, whether they are genetically modified or not. �Gene� is the root word for genetics. Genes are located on chromosomes"
"which crop is the crop most often used for silage.
",corn 
which environmental condition does the Cassava green mite have.,hot and dry conditions
What are some of the methods that farmers in Uganda use to control armyworms?,"early detection, biological control, chemical control, crop rotation, and cultural control"
What is the recommended dosage of fertilizer for growing strawberries in sandy soil?,"Generally, a balanced fertilizer with an NPK ratio of 10-10-10 is recommended for sandy soil. However, the exact dosage may vary depending on the specific soil conditions and the age of the plants"
what are principal factors of soil quality.,"soil salination, pH, microorganism balance and the prevention of soil contamination"
what is CBB,Cassava Bacterial Blight (CBB) is a bacterial disease that affects cassava plants
what are cover crops,are plants that are planted to cover the soil rather than for the purpose of being harvested
what does S. exempta larvae feeds on?,Poaceae
Name one breed of a horse,ponies
what are the sustainable approaches to cassava disease management?,breeding disease-resistant varieties and using natural pest control methods.
How are maize planted?,"the maize seeds are planted either by hand or machine, depending on the scale of the operation"
what is the optimal temperature and humidity in the greenhouse suitable for maize plants., maize plants require warm temperatures and high humidity for optimal growth
How often can i sprinkle liquid manure?,"Generally, liquid manure can be applied every 2-4 weeks during the growing season for most crops. However, it is important to avoid over-application, which can lead to nutrient imbalances, water pollution, and plant damage."
"Besides cow dung and urine, what does farmyard manure contain.",Animal bedding
Organic farms that raise livestock such as dairy cows or chickens feed the animals with?,natural food
What type of maize seed is resistant to pests and diseases?,Bt maize
What is the process of field drying and threshing maize?,Post-harvest management
list symptoms of maize streak disease.,"Stunted growth: Infected maize plants often exhibit stunted growth compared to healthy plants. The plants may fail to reach their normal height and size.

Chlorotic streaks or stripes: One of the characteristic symptoms of maize streak virus is the appearance of chlorotic streaks or stripes on the leaves. These streaks are usually pale yellow to white in color and run parallel to the leaf veins.

Necrosis or browning: As the infection progresses, the chlorotic streaks may turn necrotic or brown. This necrosis can extend to the entire leaf blade, resulting in a scorched or burnt appearance.

Leaf curling and twisting: Infected maize leaves may exhibit curling and twisting, with a downward or upward curling of the leaf margins. This distortion is more prominent in severe infections.

Reduced grain production: Maize plants infected with maize streak virus often experience a reduction in grain production. Infected plants may have fewer or smaller ears, and the kernels may be poorly developed or discolored.
"
How has farming changed in the United States?,"The growth of farming brought many laborsaving devices to 19th- and early 20th-century farm life, including reaping and threshing machines, which replaced work done by hand. Today, with modern methods of agriculture that include complex machinery, scientific breeding, and chemical pesticides, farms require far fewer workers."
which plant nutrient helps in formation of chlorophyll . , magnesium (Mg)
which variety of maize has a hard outer layer and is typically used for animal feed.,Flint maize
what is Tillage.," is the practice of breaking up the soil with tools such as the plow or harrow to prepare for planting, for nutrient incorporation, or for pest control."
which continents are cassava  referred to as an important source of food and income for millions of people.,"Africa, Asia, and Latin America"
What characteristics should a good crop store have to prevent pest,"Good ventilation: Proper air circulation is crucial to prevent the buildup of moisture, which can attract pests like molds, mites, and insects. The store should have vents or fans to allow fresh air to enter and stale air to exit.

Dryness: Most pests prefer humid conditions, so a dry store is less attractive to them. The store should be free from leaks, and the walls and floor should be made of materials that do not absorb moisture.

Cleanliness: A clean store reduces the likelihood of pest infestation. Any spilled grain or produce should be promptly cleaned up, and the store should be regularly swept and sanitized.

Pest monitoring: Regular inspection of stored crops is essential to detect any signs of pest infestation early. Traps or baits can be used to monitor and control pests.

Pest control: If pests are detected, appropriate control measures should be taken immediately. This can include the use of insecticides, fumigation, or physical removal of infested crops.

Proper storage containers: Crops should be stored in appropriate containers, such as airtight containers, to prevent pests from entering. The containers should be made of materials that do not release harmful chemicals or odors that can affect the quality of the stored crops.

Proper storage location: The store should be located away from sources of pests, such as animal pens or garbage dumps. Additionally, the store should be located in an area that is accessible for regular monitoring and maintenance."
what is plant nutrition?,refers to the process by which plants obtain and utilize essential nutrients for growth and development. 
what are some of the factors to consider while applying liquid fertilizer.,"type of crops, soil type, and weather conditions"
What is the appropriate distance for planting beans,"The appropriate distance for planting beans can vary depending on several factors such as the bean variety, soil fertility, and available resources. However, as a general guideline, bush beans are typically planted with a spacing of 6-8 inches (15-20 cm) between plants and 18-24 inches (45-60 cm) between rows. This spacing allows the plants to have enough room for proper growth, airflow, and access to sunlight. For pole beans, which require support, you can plant them in rows spaced about 3 feet (90 cm) apart, with the plants spaced 6-8 inches (15-20 cm) apart within the rows."
cam maize grow in clay soil,"es, maize can grow in clay soil. However, clay soil has certain characteristics that can affect maize growth and productivity. Clay soil tends to retain water and drain poorly, which can lead to waterlogged conditions and root suffocation if not properly managed. Additionally, clay soil can be compacted, making it harder for roots to penetrate and access nutrients."
"White flies have become resistant to pesticides, what else can farmers do eradicate them?","Integrated pest management (IPM): IPM is a holistic approach to pest management that involves a combination of techniques to control pests, including cultural, biological, and chemical methods. IPM can help to reduce the reliance on pesticides and prevent the development of pesticide resistance."
How is maize  stored after harvesting?,use of hermetic storage bags or containers 
How does environmental condition contributes to the spread of maize streak disease.,Maize streak disease tends to be more prevalent and severe in regions with warmer temperatures and high humidity. These conditions favor the growth and activity of both the virus and its leafhopper vectors.
name two types fertilizers.,organic and inorganic fertilizers
what is advantages of spacing beans appropriately during planting.,"Adequate spacing between bean plants allows for better air circulation, reducing the risk of fungal diseases. Good air movement helps to keep the foliage dry, preventing the development and spread of diseases such as powdery mildew or rust."
"What size should cassava stem be for planting?

",between 25 to 30 centimeters in length
what is Agroforestry.,"Agroforestry involves the integration of trees with crops and/or livestock, which can help to increase soil organic matter, reduce erosion, and improve soil structure."
how many chambers does a cow has,four chambers
why are farmers advisable to leave bean stalk in the garden.,". Bean stalks are rich in nutrients and organic material, which can contribute to improving soil fertility and structure. When the bean stalks decompose, they release nutrients back into the soil, making them available for the next crop."
what are some of the tips on how to best use PICS bags for storing maize grains.,"Clean and dry the grains: Before storing maize grains in PICS bags, make sure that they are thoroughly cleaned and dried to a moisture content of around 12-13%. This will help prevent mold and insect growth.

Fill the bags completely: Fill the PICS bags completely with the maize grains, leaving no empty space. This will help prevent the buildup of oxygen and moisture, which can lead to spoilage and insect growth.

Seal the bags tightly: After filling the bags with maize grains, seal them tightly using the PICS bag sealer or a heat sealer. Make sure that there are no holes or leaks in the bags, as this can allow air and moisture to enter.

Store the bags in a cool and dry place: Store the PICS bags in a cool and dry place, away from direct sunlight and sources of moisture. A well-ventilated room or a grain storage facility is ideal for storing PICS bags.

Check the bags regularly: Check the PICS bags regularly for any signs of damage, such as holes or leaks, and for any signs of insect or mold growth. If any damage or signs of infestation are found, take immediate action to prevent further damage."
What maize variety has early maturity and how  many days?,H624
what is physical pest control.,involves trapping or killing pests such as insects and rodents
which key districts produces maize in uganda?,"Masindi, Kapchorwa, Kasese, Jinja, Kabarole and Mbale"
which variety of maize that is widely grown and used for both human and animal consumption.,Dent maize
which organic matter help improve soil fertility.,compost or well-rotted manure
 can delaying weeding cassava cause cassava mosaic,"Delaying weeding in cassava fields can create favorable conditions for the spread of Cassava Mosaic Disease (CMD). Weeds can act as alternative hosts for the whiteflies that transmit the virus responsible for CMD. When weeds are left to grow and multiply in the cassava field, they can attract whiteflies and serve as a reservoir for the virus. These whiteflies can then spread the virus to the cassava plants, leading to infection and the development of mosaic symptoms."
how many teats or nipples does a cow has?,"four nipples, or teats"
What are some of biological properties of soil that soil scientists study?, microbial communities that live in the soil and the interactions between these organisms and the plants that grow in the soil.
what is the most popular crop in midwest?,Soybeans 
what is animal welfare?,refers to the conditions in which an animal is raised
what are some of the  preventive measures for managing CMD,"planting virus-free or resistant cassava varieties, practicing good field sanitation, and controlling whitefly populations through integrated pest management strategies. Early detection and removal of infected plants can also help prevent the spread of the disease within a field or area."
what is Payment for ecosystem services., is a method of providing additional incentives to encourage farmers to conserve some aspects of the environment
why do farmers plant cover crops?,"Cover crops manage soil erosion, soil fertility, soil quality, water, weeds, pests, diseases, biodiversity and wildlife in an agroecosystem"
what are the control measures for Cassava Anthracnose Disease:," use of disease-free planting material, crop rotation, and the application of fungicides."
Farmers always ask for the reason why nitrogenous fertilizer are only top dress,"Nitrogen uptake timing: Nitrogen is an essential nutrient for plant growth and is necessary for various physiological processes, including leaf and stem development. However, nitrogen is a highly mobile nutrient in the soil and can easily leach or wash away if applied too early in the growing season. Therefore, to ensure that the plants have an adequate and readily available nitrogen supply during their active growth phase, nitrogenous fertilizers are often applied as top dressing when the plants are well-established.

Crop demand for nitrogen: Many crops, including maize, have a high demand for nitrogen during their vegetative growth stage. By applying nitrogenous fertilizers as top dressing during this period, it helps meet the crop's nutrient requirements when they need it the most. This timing allows for optimal nitrogen utilization by the plants and promotes vigorous vegetative growth.

Minimizing nitrogen losses: By applying nitrogenous fertilizers as top dressing, farmers can better manage and minimize nitrogen losses from leaching or volatilization. Top dressing allows for a more targeted application directly to the root zone, reducing the risk of nutrient runoff or wastage. It also ensures that the nitrogen remains available to the plants when they require it, improving nutrient efficiency and minimizing environmental impacts."
how do cover crops suppress weeds after death,they smother the next flush of weeds by forming a mulch layer on the soil surface
why does the use of herbicides requires proper training and application.,to avoid damage to the cassava plants and the environment
which crops can be intercropped with cassava to help attract natural predators of cassava beetles., legumes or grasses
Name the pest control management practices.," Chemical (pesticides), biological (biocontrol), mechanical (tillage), and cultural practices are used"
name two types of beans found in the garden,bush beans and pole beans
what is plant nutrition?,refers to the process by which plants obtain and utilize essential nutrients for growth and development. 
which substance is applied in acidic soil to balance soil PH.,lime
what factors can lead to low maize harvest.,"Weather conditions: Unfavorable weather such as drought, excessive rainfall, hailstorms, or extreme temperatures can negatively impact maize growth and reduce yields.

Pest and disease outbreaks: Outbreaks of pests and diseases, such as fall armyworm, maize stalk borers, or maize rust, can significantly damage maize crops and reduce yields.

Poor soil fertility: Inadequate soil nutrients or imbalanced nutrient levels can affect maize growth and productivity. Lack of proper soil management practices, such as inadequate fertilization or soil erosion, can contribute to low yields.

Lack of access to inputs: Limited availability or affordability of quality seeds, fertilizers, pesticides, and other agricultural inputs can hinder maize production and result in lower yields.

Farm management practices: Inefficient farming practices, improper crop rotation, inadequate weed control, or suboptimal planting and harvesting techniques can impact maize yields.

Market conditions: Maize prices, market demand, and access to markets can also influence farmers' decisions and investment in maize production. Unfavorable market conditions may discourage farmers from growing maize or affect their profitability."
what kind of information is collected by tools used in precision agriculture?," soil moisture, nutrient levels, and other factors"
what is the effect of applying too much fertilizers.,"can lead to reduced phosphorus and potassium uptake by crops, while applying too little can lead to nutrient deficiencies and reduced crop yields"
what is Land transformation.,the use of land to yield goods and services
what are the signs and symptoms of CBB disease?,"The disease causes wilting, yellowing of the leaves, and rotting of the stems and roots"
Name the cultural pest control practicies.,"crop rotation, culling, cover crops, intercropping, composting, avoidance, and resistance"
how can farmers control bacterial blight.," it's important to use disease-free planting material, practice good sanitation by regularly removing and destroying infected plant material, control insect vectors, and avoid working in cassava fields when plants are wet"
why are farmers encouraged to do proper seed bed preparation.,"Proper seed bed preparation creates a favorable environment for seed germination. It helps to loosen the soil, remove debris, and create a fine and level surface where seeds can make good contact with the soil, facilitating better seed-to-soil contact and increasing the chances of successful germination."
What is the right spacing of cassava,"The recommended spacing for cassava depends on various factors such as the variety of cassava, soil fertility, and the intended use of cassava (for roots or leaves). However, a commonly used spacing for cassava is around 1 meter (3 feet) between plants within rows and 1.5 to 2 meters (5 to 6.5 feet) between rows. This spacing allows sufficient room for the cassava plants to grow and develop a healthy root system. It is advisable to consult local agricultural extension services or cassava experts for specific spacing recommendations tailored to your local conditions."
"What are some common pests and diseases that can affect beans, and how can they be managed?","Common pests include aphids, thrips, and spider mites, while diseases such as bacterial blight and rust can also affect the crop. Pest and disease management typically involves the use of chemical or organic pesticides and fungicides, as well as proper crop rotation to reduce the risk of infection"
What are the limitations of using seeds for propagations.,"Seeds produced by sexually reproducing plants can exhibit genetic variability, resulting in inconsistent traits among plants grown from seed."
What is the effect of moisture on stored beans?,"Moisture is one of the key factors that affect the quality and shelf life of stored beans. Here are some of the effects of moisture on stored beans: Mold growth,Insect infestation,Sprouting,Hardening and discoloration,Nutrient loss."
what is the recommended season for planting cassava., It is recommended to plant cassava at the beginning of the rainy season when there is enough moisture in the soil.
what is Couch grass?,is a persistent weed that can be difficult to control in cassava gardens
what  is the role of Center for Disease Control(CDC). ,"to prevent �illness, disability and death due to domestic and imported foodborne diseases"
what are organic fertilizers?," are derived from natural sources such as animal manure, compost, and plant residues"
What are the side effects of preservatives on human health?,"Allergic reactions: Some people may be allergic to certain preservatives, such as sulfites, which are commonly used in dried fruits, wine, and other foods. Symptoms of an allergic reaction to preservatives can include hives, itching, swelling, difficulty breathing, and anaphylaxis, a severe and potentially life-threatening reaction."
What percentage did vitamin C in fresh broccoli dropped?, 50% within one week
why is migration benefical to moths?,it allows the species to travel to a new location with fewer predators and less possibility of parasitism and infection
