question,answers
which stage of crop cultivation involves placing seeds or seedlings into the soil at the right depth and spacing.,Planting 
which pest feeds on the sap of the cassava plant.,Cassava mealybug:
which region in African has the armyworm,Sahara
why are farmers not encouraged to collect soil samples compost piles or manure storage., These areas may have localized nutrient concentrations that do not represent the overall soil fertility.
which symptoms are evident of Micronutrient deficiencies,"leaf discoloration, reduced growth, and poor reproductive performance"
Is it true that i can make glue from cassava,"Yes, cassava can be used to make glue. Cassava is a starchy root vegetable that is native to South America, but is now grown in many parts of the world. The starchy content of cassava can be extracted and used to make a type of adhesive or glue"
name other ways a farmer can use to control CBSD.,Planting resistant varieties
what are Single nutrient fertilizers., supply 1 or 2 of these nutrients.
what is the purpose of threshing .,The purpose of the threshing process is to detach the grain from the panicles
what is the use of cow's special stomach,to store food for later chewing and digestion once they were hidden and out of danger
what is isolation.,"A minimum separation distance required in a seed multiplication field in order to prevent
contamination by physical mixtures or disease vectors"
which other method is used to improve clay soil for maize production.,"Use cover crops: Growing cover crops, such as clover or rye, can help improve soil health and structure by adding organic matter, breaking up soil compaction, and reducing erosion. Cover crops can also help reduce weed pressure and increase soil moisture retention.
"
What are the side effects of preservatives on human health?,"Allergic reactions: Some people may be allergic to certain preservatives, such as sulfites, which are commonly used in dried fruits, wine, and other foods. Symptoms of an allergic reaction to preservatives can include hives, itching, swelling, difficulty breathing, and anaphylaxis, a severe and potentially life-threatening reaction."
how does neem oil works as pesticide.," It works by disrupting the feeding and reproductive systems of insect pests. Neem oil is effective against a range of pests that attack bean leaves, including aphids, bean beetles, and whiteflies."
how can farmers mitigate leaf shedding in cassava during the dry season,"Irrigation: Providing supplemental irrigation to cassava plants during dry periods can help alleviate water stress and maintain adequate soil moisture levels.

Mulching: Applying organic mulch around the cassava plants can help conserve soil moisture, regulate soil temperature, and reduce water evaporation from the soil surface.

Fertilization: Ensuring optimal nutrient levels through balanced fertilization can help maintain the health and vigor of cassava plants, reducing the risk of nutrient deficiencies and associated leaf shedding.

Pest and disease management: Implementing appropriate pest and disease control measures, such as regular scouting and timely application of recommended treatments, can help minimize leaf damage and subsequent leaf shedding."
how do i check for corn maturity?,"test the kernel moisture content using a moisture meter. Additionally, the husks on the ears should have turned brown and dry"
how do you space maize when planting.,when spacing maize it may solely depend on the variety of the maize taken up and or if an intercropping pattern is used on the maize field
"For example, if the beans are infested with bean weevils or bean fly, when is it recommended to spray?","it is recommended to apply insecticides at the early stages of plant growth, when the pests are most active"
what is soil?,"Soil is a complex mixture of minerals, organic matter, water, air, and living organisms."
which technical allows for water status monitoring and automate water usage.,precision agriculture
what are green manure used for?,to manage a range of soil macronutrients and micronutrients
Do the use of artificial fertilizers degrade the soil? ," Artificial fertilizers primarily provide nutrients without adding organic matter to the soil. This can lead to a decrease in organic matter content over time, affecting soil structure, water-holding capacity, and nutrient cycling."
when can Calcium Ammonium Nitrate (CAN) be applied in maize?,After 2-3 weeks or when the crop is about 45cm high
what is the approximate Global agricultural production of food.,11 billion tonnes
what is Livestock management.,"involves taking care of different animals that are raised for various purposes, such as meat, milk, wool, and eggs."
which key districts produces maize in uganda?,"Masindi, Kapchorwa, Kasese, Jinja, Kabarole and Mbale"
What is the best time of year to plant soybeans in the Midwest?, between late April and mid-May
what biological method can a farmer use to control cassava whitefly.,"introduction of natural enemies of the whitefly,"
How has farming changed in the United States?,"The growth of farming brought many laborsaving devices to 19th- and early 20th-century farm life, including reaping and threshing machines, which replaced work done by hand. Today, with modern methods of agriculture that include complex machinery, scientific breeding, and chemical pesticides, farms require far fewer workers."
What are genetically modified organisms (GMOs)?,GMOs are defined as �organisms in which the genetic material (DNA) has been altered in a way that does not occur naturally.
Which two types of beans gives high yields...the climbing beans or the ordinary beans?,Both climbing beans and bush (ordinary) beans can give high yields if they are properly managed and grown under suitable conditions. 
"What are some common pests and diseases that can affect beans, and how can they be managed?","Common pests include aphids, thrips, and spider mites, while diseases such as bacterial blight and rust can also affect the crop. Pest and disease management typically involves the use of chemical or organic pesticides and fungicides, as well as proper crop rotation to reduce the risk of infection"
why cassava widely grown?,its ability to thrive in poor soils and withstand drought
how does neem oil works as pesticide.," It works by disrupting the feeding and reproductive systems of insect pests. Neem oil is effective against a range of pests that attack bean leaves, including aphids, bean beetles, and whiteflies."
Which soil is better for maize production?,"Maize requires well-drained soils with a good supply of nutrients and moisture. It cannot withstand even a slight degree of waterlogging and therefore can be killed if stands in water for a day. Preferred soil for maize production should also be deep, well-aerated with moderate pH 5.5-6.5, and rich in organic matter."
why is soil health vital?,"Soil health is critical to crop growth and productivity, as it provides the necessary nutrients and support for plants to thrive."
During which phases are the S. exempta species susceptible to a cytoplasmic virus.,During the pupal and pre-pupal stages
how can rainfall increase water quality.," improve water quality by replenishing rivers, streams, and groundwater supplies"
can the use of farmyard manure increased infiltration?," FYM improves soil permeability and enhances water infiltration into the soil. The organic matter in FYM improves soil structure, creating larger pore spaces that allow water to penetrate more easily into the soil rather than running off the surface."
how can planting Green manure cover crops helps increase soil fertility.,"Planting leguminous crops such as clover, alfalfa or beans, can help fix nitrogen into the soil and add organic matter, thus improving soil fertility."
Can over boiling maize make it loss Carbohydrates?," Boiling maize grains does not significantly affect the carbohydrate content, so the length of time for boiling is not critical for this nutrient."
what is the right spacing for beans when plantimg?,about 2-4 inches apart
"which insecticide is used to control various pests, including bean fly and aphids.",Imidacloprid
"Besides cow dung and urine, what does farmyard manure contain.",Animal bedding
why do crops require regular maintainance after planting,to ensure healthy growth and yield
why are farmers encouraged to do proper seed bed preparation.,"Proper seed bed preparation creates a favorable environment for seed germination. It helps to loosen the soil, remove debris, and create a fine and level surface where seeds can make good contact with the soil, facilitating better seed-to-soil contact and increasing the chances of successful germination."
why is post-harvest management important for preserving the quality of beans?,to prevent mold growth and insect infestation
why should farmers replace old seed during planting.,"using old seeds can result in poor germination rates, uneven plant growth, and reduced resistance to environmental stressors such as drought, pests, and diseases."
What bean variety has early maturity  and how many days?,NARO Case 1
What is the process of field drying and threshing maize?,Post-harvest management
Is uganda among the largest cassava producers in Africa?,Certainly
how can timing and method of fertilizer application improves soil fertility.,"The timing and method of fertilizer application, such as surface application, broadcasting, or placement, can influence nutrient availability and uptake by crops. For example, applying nitrogen fertilizer at planting may promote early crop growth and development, while side-dressing or top-dressing may promote later growth and fruiting."
which variety is popular in north and tolerant to drought.,Albert
what is plant biotechnology,a set of techniques used to adapt plants for specific needs or opportunities
what factors does the yield of beans depends on?,"variety, soil fertility, water availability, and pest and disease management."
what is the effect severe CBSD , reducing yields and making cassava roots unsuitable for consumption or processing
How long should a farmer wait to plant cassava in a field which was affected by cbsd?,"Farmers should wait for at least 6 months to 1 year before planting cassava in a field that was affected by Cassava Brown Streak Disease (CBSD). This allows enough time for the virus to die off or decrease in the soil. During this period, the farmer should practice proper land preparation, including removing all cassava crop debris and weed the field to reduce the build-up of virus inoculum in the soil."
"which nutrient  is important for root development, flowering, and fruiting.",Phosphorus 
what are fertilizers?,Fertilizers are substances that are added to soil to improve the growth and quality of crops
in which phase is the armyworms species dangerous to crops., gregaria
which substance is applied in acidic soil to balance soil PH.,lime
how is threshing done.,"achieved through rubbing, stripping, or impact action, or using a combination of these actions. The operation can be performed manually (trampling, beating), using animal power, or mechanical threshers"
"which crop is the crop most often used for silage.
",corn 
what is the botanical name for Cassava green mite.,Mononychellus tanajoa
what is harvesting,It involves removing the mature crops from the field and preparing them for storage or transport
does spacing reduce competition for resources?,"When beans are spaced adequately, there is less competition among plants for essential resources like water, nutrients, and light. This allows each plant to access the resources it needs without being hindered by neighboring plants, resulting in more vigorous growth.
"
how is root rot spread?,"spread through infected soil, water, and planting material"
what does NPK stands for.,"(nitrogen, phosphorus, and potassium"
what is milled maize?,milled maize (also known as maize flour) is made by grinding the kernels of the maize plant into a fine powder
why should  cassava be processed or sold quickly after harvesting.," to prevent spoilage and maintain quality.
"
How can I test for moisture in maize at a local level,"Hand Feel: Take a handful of maize kernels and squeeze them tightly in your hand. If the kernels feel hard and dry, it indicates low moisture content. If they feel slightly pliable or soft, it suggests higher moisture content.

Bite Test: Take a few kernels and try to bite into them. If they crack easily, it indicates lower moisture content. If they are chewy or squashy, it suggests higher moisture content.

Visual Inspection: Examine the appearance of the kernels. If they appear shriveled, discolored, or have damaged husks, it could indicate lower moisture content. If the kernels appear plump, shiny, and well-hydrated, it suggests higher moisture content.
"
"For example, if the beans are infested with bean weevils or bean fly, when is it recommended to spray?","it is recommended to apply insecticides at the early stages of plant growth, when the pests are most active"
how is threshing done.,"achieved through rubbing, stripping, or impact action, or using a combination of these actions. The operation can be performed manually (trampling, beating), using animal power, or mechanical threshers"
how do we call the cover crops that increases soil fertility.,green manure
What is a seed drill?,a device that allowed farmers to plant seeds in the soil and then cover them up
which nutrient is leguminous crops high in?,nitrogen 
What are the uses of soil air,"oil air plays an important role in the growth and development of plants by providing oxygen for respiration and other metabolic processes. Soil air also helps to maintain the proper soil moisture levels, which are essential for plant growth. "
how can distinguish female from male,Females and males can be distinguished by the number of bristles on their frenulum
What are the symptoms of cassava mosaic,"Leaves leaves become distorted and yellow, Poor formation of tubers, The plants is stumted, Mosaic mottling,mishapen and twisted leaflets and reduction in size of leaves"
name one GMO crop used by farmers.,insect-resistant crops
name examples of phosphorous fertilizers,triple superphosphate and diammonium phosphate.
name one way of controlling Cassava Brown Steak Disease.,Use of clean planting material
what considerations are needed when deciding the timing for sowing crops after a prolonged dry spell.,"Wait for the onset of the rainy season: Begin sowing when there is a reasonable expectation of consistent rainfall. The start of the rainy season can vary from year to year, so it's helpful to consult local meteorological services or agricultural extension offices for information on the typical timing of the rainy season in your region.

Soil moisture: Ensure that the soil has enough moisture to support seed germination and early plant growth. This can be assessed by checking the soil's moisture content and ensuring that it is suitable for seed establishment."
which districts in Uganda produce maize.," Kapchorwa, Iganga, Masindi, Mbale, Mubende, Kasese, Kamuli, Jinja And Kabarole districts."
List the Animal Care Principles for producers,"access to food and water, health and veterinary care, appropriate environmental and living conditions, implementing science?�based husbandry practices, using proper handling practices and providing comfortable and sanitary transportation to avoid stress"
what is a test dig?,dig to check if the tubers are ready for harvesting
which other regions in Uganda grow apples?,"Bugisu, Bukedi and
Sebei sub regions in areas around Mt. Elgon"
"apart from providing nutrients, name important of applying fertilizers."," fertilizers can also improve soil structure and fertility over time. They can help to increase soil organic matter, improve soil water-holding capacity, and reduce erosion."
What farming practice helps prevent soil erosion?,Crop Rotation
define Genetically modified organisms.,are organisms whose genetic material has been altered by genetic engineering techniques generally known as recombinant DNA technology
What is total seed population in an acre?,"For soybeans, the recommended plant population is typically higher, ranging from 100,000 to 200,000 plants per acre. This corresponds to seeding rates of approximately 125,000 to 250,000 seeds per acre."
why should farmers use farmyard manure in their garden.,helps improve the structure and texture of the soil. It contains a range of nutrients and microorganisms that can break down and decompose to provide nutrients and improve soil health
what Crop residues can be used to make farmyard manure.,"maize stalks, bean stems, and rice straw"
how do farmers control insects?,prevent insect damage by putting up insect traps or by bringing in beneficial insects that feed on the harmful ones that are causing a problem.
What is the difference between maize cob and ordinary milled in terms of food value,"maize cob may be a source of animal feed, milled maize has higher food value and is an important staple food for many people around the world."
which stage of crop cultivation involves placing seeds or seedlings into the soil at the right depth and spacing.,Planting 
How does FAO defines agricultural automation.,"FAO defines agricultural automation as the use of machinery and equipment in agricultural operations to improve their diagnosis, decision-making or performing, reducing the drudgery of agricultural work and/or improving the timeliness, and potentially the precision, of agricultural operations."
what is milled maize?,milled maize (also known as maize flour) is made by grinding the kernels of the maize plant into a fine powder
name other chemicals used for seed dressing.,"imidacloprid, clothianidin, and thiamethoxam, which are neonicotinoid insecticides."
which maize variety has a maturity of 80 days.,PHB 3253
